rank,uri,artist_names,track_name,source,peak_rank,previous_rank,days_on_chart,streams
1,"spotify:track:5vNRhkKd0yEAg8suGBpjeY","ROSÉ, Bruno Mars","APT.","Atlantic Records",1,1,45,"9142925"
2,"spotify:track:2plbrEY59IikOBgBGLjaoe","Lady Gaga, Bruno Mars","Die With A Smile","Interscope",1,2,108,"8933727"
3,"spotify:track:2FRnf9qhLbvw8fu4IBXx78","Wham!","Last Christmas","Epic",2,5,375,"8630583"
4,"spotify:track:0bYg9bo50gSsH3LtXe2SQn","Mariah Carey","All I Want for Christmas Is You","Columbia",1,3,441,"8390495"
5,"spotify:track:2EjXfH91m7f8HiJN1yQg97","Brenda Lee","Rockin' Around The Christmas Tree","MCA Nashville",2,9,307,"6869709"
6,"spotify:track:6dOtVTDdiauQNBQEDOtlAB","Billie Eilish","BIRDS OF A FEATHER","Darkroom/Interscope Records",1,7,199,"5747717"
7,"spotify:track:6BPcUXYERAahpunmb0AovH","Arcane, Stromae, Pomme","Ma Meilleure Ennemie (from the series Arcane League of Legends)","Riot Games",3,4,8,"5716809"
8,"spotify:track:2CGNAOSuO1MEFCbBRgUzjd","Kendrick Lamar, SZA","luther (with sza)","pgLang, under exclusive license to Interscope Records",3,6,10,"5586999"
9,"spotify:track:6TkXViJUO3SA6FMcrNwlD9","Bobby Helms","Jingle Bell Rock","Universal Digital Enterprises",4,13,302,"5545503"
10,"spotify:track:0lizgQ7Qw35od7CYaoMBZb","Ariana Grande","Santa Tell Me","Universal Records",3,14,319,"5428702"
11,"spotify:track:7ne4VBA60CxGM75vw0EYad","Gracie Abrams","That’s So True","Gracie Abrams, under exclusive license to Interscope Records",4,8,45,"5370040"
12,"spotify:track:7tI8dRuH2Yc6RuoTjxo4dU","Jimin","Who","BIGHIT MUSIC",1,10,136,"5237639"
13,"spotify:track:2uFaJJtFpPDc5Pa95XzTvg","Dean Martin","Let It Snow! Let It Snow! Let It Snow!","Capitol Records",6,18,219,"4915886"
14,"spotify:track:7uoFMmxln0GPXQ0AcCBXRq","Sia","Snowman","Monkey Puzzle/Atlantic",9,20,254,"4715276"
15,"spotify:track:1IcR6RlgvDczfvoWJSSY2A","Andy Williams","It's the Most Wonderful Time of the Year","Columbia/Legacy",5,21,278,"4650133"
16,"spotify:track:1rv46mRwDqMEhOBZ7vODg3","Michael Bublé","It's Beginning to Look a Lot like Christmas","Reprise",3,27,296,"4494574"
17,"spotify:track:3nAp4IvdMPPWEH9uuXFFV5","Kelly Clarkson","Underneath the Tree","RCA Records Label",8,26,238,"4482667"
18,"spotify:track:0aB0v4027ukVziUGwVGYpG","Kendrick Lamar, Lefty Gunplay","tv off (feat. lefty gunplay)","pgLang, under exclusive license to Interscope Records",5,11,10,"4261316"
19,"spotify:track:2262bWmqomIaJXwCRHr13j","Gigi Perez","Sailor Song","Gigi Perez PS/ Island",6,15,106,"4066009"
20,"spotify:track:0nj9Bq5sHDiTxSHunhgkFb","Kendrick Lamar","squabble up","pgLang, under exclusive license to Interscope Records",3,12,10,"3887674"
21,"spotify:track:3qCeq0rWK67SoBDgFd2sId","José Feliciano","Feliz Navidad","RCA Records Label",7,32,235,"3828436"
22,"spotify:track:1cOboCuWYI2osTOfolMRS6","Oscar Maydon, Fuerza Regida","Tu Boda","Rancho Humilde/Sony Music Latin",4,16,61,"3719841"
23,"spotify:track:67mgz7S5y7hnCE63YBjfO6","Michael Bublé","Holly Jolly Christmas","Reprise",10,34,241,"3666783"
24,"spotify:track:50zAEIE4B1QqhPjRMK2Xmh","Jin","Running Wild","BIGHIT MUSIC",6,17,17,"3590999"
25,"spotify:track:2HRqTpkrJO5ggZyyK6NPWz","Sabrina Carpenter","Espresso","Island Records",1,19,234,"3579425"
26,"spotify:track:3QaPy1KgI7nu9FJEQUgn6h","Billie Eilish","WILDFLOWER","Darkroom/Interscope Records",9,22,199,"3575678"
27,"spotify:track:1Es7AUAhQvapIcoh3qMKDL","The Weeknd, Playboi Carti","Timeless (feat Playboi Carti)","XO / Republic Records",2,23,66,"3361227"
28,"spotify:track:7fUYUcWy853HS8YJn0b3Sr","The Ronettes","Sleigh Ride","Legacy Recordings",9,43,198,"3294480"
29,"spotify:track:5G2f63n7IPVPPjfNIGih7Q","Sabrina Carpenter","Taste","Island Records",2,24,101,"3226565"
30,"spotify:track:6IeK3Ap5m3HabwJxgI6eSE","Perry Como, The Fontane Sisters, Mitchell Ayres & His Orchestra","It's Beginning to Look a Lot Like Christmas (with Mitchell Ayres & His Orchestra)","RCA Records Label",20,47,175,"3043109"
31,"spotify:track:0l0vcZMU7AOeQmUIREoI2U","Rauw Alejandro, Bad Bunny","Qué Pasaría...","Sony Music Latin/Duars Entertainment",13,25,17,"2991780"
32,"spotify:track:0WbMK4wrZ1wFSty9F7FCgu","Chappell Roan","Good Luck, Babe!","Chappell Roan PS/ Island",5,30,237,"2988086"
33,"spotify:track:3xkHsmpQCBMytMJNiDf3Ii","Benson Boone","Beautiful Things","Night Street Records, Inc./Warner Records Inc.",1,33,318,"2859211"
34,"spotify:track:7xapw9Oy21WpfEcib2ErSA","Justin Bieber","Mistletoe","RBMG/Def Jam",11,58,264,"2844857"
35,"spotify:track:5humEOJehpAwMJEJmb0JJ2","Nat King Cole","The Christmas Song (Merry Christmas To You)","Capitol Records",14,54,214,"2807559"
36,"spotify:track:6WatFBLVB0x077xWeoVc2k","KAROL G","Si Antes Te Hubiera Conocido","Bichota/Interscope Records",4,28,164,"2798036"
37,"spotify:track:1YYfyJ2yCvGFCxwjsIqEK9","Rauw Alejandro, Romeo Santos","Khé?","Sony Music Latin/Duars Entertainment",23,31,17,"2735189"
38,"spotify:track:3hRV0jL3vUpRrcy398teAU","Lord Huron","The Night We Met","Play It Again Sam",15,40,853,"2734922"
39,"spotify:track:7G7mSV4BebkoHWwKTDvXu9","V, Park Hyo Shin","Winter Ahead (with PARK HYO SHIN)","BIGHIT MUSIC",15,29,3,"2722222"
40,"spotify:track:4tHqQMWSqmL6YjXwsqthDI","John Williams","Carol of the Bells (From ""Home Alone"" Soundtrack)","Masterworks",29,46,66,"2721096"
41,"spotify:track:5XeFesFbtLpXzIVDNQP22n","Arctic Monkeys","I Wanna Be Yours","Domino Recording Co",11,37,879,"2651272"
42,"spotify:track:7KA4W4McWYRpgf0fWsJZWB","Tyler, The Creator, Kali Uchis","See You Again (feat. Kali Uchis)","Columbia",13,39,638,"2616252"
43,"spotify:track:2TE4xW3ImvpltVU0cPcKUn","Shakin' Stevens","Merry Christmas Everyone","Sony Music CG",16,87,197,"2590765"
44,"spotify:track:7sd6zMrgGpEa7NkQm9TRrg","Tito Double P","NADIE","Double P Records",32,35,10,"2586311"
45,"spotify:track:27RYrbL6S02LNVhDWVl38b","John Lennon, Yoko Ono","Happy Xmas (War Is Over) - Remastered 2010","EMI Catalogue",7,83,217,"2571762"
46,"spotify:track:0cQVqPuHQP4KEwc7ZUQmj6","The Neighbourhood","Sweater Weather","Columbia",14,38,1560,"2536918"
47,"spotify:track:2tHwzyyOLoWSFqYNjeVMzj","Sabrina Carpenter","Please Please Please","Island Records",1,42,178,"2533053"
48,"spotify:track:0KKkJNfGyhkQ5aFogxQAPU","Bruno Mars","That's What I Like","Atlantic Records",5,44,806,"2458047"
49,"spotify:track:7CyPwkp0oE8Ro9Dd5CUDjW","The Weeknd, JENNIE, Lily-Rose Depp","One Of The Girls (with JENNIE, Lily Rose Depp)","XO / Republic Records",2,41,421,"2418549"
50,"spotify:track:2QxekHjOYDnzNO5w8hu2D9","Juice WRLD","Empty Out Your Pockets","Grade A Productions/Interscope Records",50,-1,1,"2399357"
51,"spotify:track:51rfRCiUSvxXlCSCfIztBy","Gracie Abrams","I Love You, I'm Sorry","Gracie Abrams, under exclusive license to Interscope Records",15,50,125,"2342444"
52,"spotify:track:17phhZDn6oGtzMe56NuWvj","Teddy Swims","Lose Control","Warner Records",5,36,382,"2335827"
53,"spotify:track:1SV1fxF65n9NhRHp3KlBuu","Paul McCartney","Wonderful Christmastime - Edited Version / Remastered 2011","Paul McCartney Catalog",10,96,212,"2296684"
54,"spotify:track:3XsaSIPWvM61RIFfeb0BBR","Bing Crosby, Ken Darby Singers, John Scott Trotter & His Orchestra","White Christmas - 1947 Version","Geffen",10,88,221,"2293143"
55,"spotify:track:5g7sDjBhZ4I3gcFIpkrLuI","Bruno Mars","Locked out of Heaven","Atlantic Records",21,45,896,"2239205"
56,"spotify:track:0qeIFEGRQqHoaJtLCl0U73","Myke Towers, benny blanco","DEGENERE 👑 (feat. benny blanco)","WEA Latina",33,97,42,"2186996"
57,"spotify:track:7BqBn9nzAq8spo5e7cZ0dJ","Bruno Mars","Just the Way You Are","Elektra (NEK)",27,48,694,"2168034"
58,"spotify:track:5lKFO0PrOC9jmOlPEdjHsL","Tito Double P, Peso Pluma","DOS DÍAS","2024 Double P Records",24,51,94,"2166148"
59,"spotify:track:3ra4PQCtSVULClEqj2XXf7","Frank Sinatra","Let It Snow! Let It Snow! Let It Snow!","WTM CLASSIC",10,102,227,"2158862"
60,"spotify:track:5QMrH5nszZZR3nefIj6Mar","Cynthia Erivo, Ariana Grande","Defying Gravity","Universal Studios and Republic Records",50,67,10,"2156273"
61,"spotify:track:6jbYpRPTEFl1HFKHk1IC0m","Tyler, The Creator, Lola Young","Like Him (feat. Lola Young)","Columbia",20,63,35,"2102173"
62,"spotify:track:4OLT65TRsOx3Iv1TlCcQVb","Gabito Ballesteros, Natanael Cano, Luis R Conriquez, Neton Vega","Presidente","Los CT Records",40,52,40,"2096651"
63,"spotify:track:27qAMKrDdKEs8HDXcvR24R","Chris Rea","Driving Home for Christmas - 2019 Remaster","Rhino",8,133,207,"2093855"
64,"spotify:track:3tFed7YsjGnIfxeLEQwx3R","Tyler, The Creator, GloRilla, Sexyy Red, Lil Wayne","Sticky (feat. GloRilla, Sexyy Red & Lil Wayne)","Columbia",9,56,35,"2089166"
65,"spotify:track:0rHToGels2lt8Y0mCYoF90","Nat King Cole","Deck The Hall","CAPITOL CATALOG MKT (C92)",23,114,50,"2062217"
66,"spotify:track:51ZQ1vr10ffzbwIjDCwqm4","Ariana Grande","we can't be friends (wait for your love)","Republic Records",1,64,269,"2062020"
67,"spotify:track:3AJwUDP919kvQ9QcozQPxg","Coldplay","Yellow","Parlophone UK",15,55,1431,"2051335"
68,"spotify:track:5O2P9iiztwhomNh8xkR9lJ","One Direction","Night Changes","Syco Music",6,68,787,"2050797"
69,"spotify:track:5fZJQrFKWQLb7FpJXZ1g7K","Shaboozey","A Bar Song (Tipsy)","American Dogwood / EMPIRE",5,49,231,"2050739"
70,"spotify:track:47ohYW8e7dxCYn9qbUMBCI","Darlene Love","Christmas (Baby Please Come Home)","Legacy Recordings",20,115,129,"2026077"
71,"spotify:track:6X6m4xmdFcz31p1h7Qg68c","Tito Double P","EL LOKERON","2024 Double P Records",19,60,93,"2011172"
72,"spotify:track:285pBltuF7vW8TeWk8hdRR","Juice WRLD","Lucid Dreams","Juice WRLD Mixtape / ISR P&D",2,75,1385,"2010459"
73,"spotify:track:2uXlHCUbq9OMUwx3hrk06o","Vance Joy","Riptide","Atlantic Records",28,77,1390,"2008713"
74,"spotify:track:0hz5PNF2wejwUKCMpesQWt","Ed Sheeran, Elton John","Merry Christmas","Atlantic Records UK",16,160,81,"2003257"
75,"spotify:track:1XBYiRV30ykHw5f4wm6qEn","The Kid LAROI","NIGHTS LIKE THIS","Columbia",34,70,162,"2001407"
76,"spotify:track:1mea3bSkSGXuIRvnydlB5b","Coldplay","Viva La Vida","Parlophone UK",27,182,827,"1993438"
77,"spotify:track:5gOfC9UzZQzTyShqPMrpjT","Kendrick Lamar","wacced out murals","pgLang, under exclusive license to Interscope Records",5,53,10,"1991300"
78,"spotify:track:1Qrg8KqiBpW07V7PNxwwwL","SZA","Kill Bill","Top Dawg Entertainment/RCA Records",1,66,724,"1968238"
79,"spotify:track:1EDPVGbyPKJPeGqATwXZvN","Linkin Park","The Emptiness Machine","Warner Records",5,57,87,"1950753"
80,"spotify:track:3vkCueOmm7xQDoJ17W1Pm3","Mitski","My Love Mine All Mine","Dead Oceans",2,95,440,"1945505"
81,"spotify:track:3qhlB30KknSejmIvZZLjOD","Djo","End of Beginning","Djo",1,79,289,"1944473"
82,"spotify:track:4K1Pg0FLno1ltzX3jeqT83","Kendrick Lamar, Wallie the Sensei, Siete7x, Roddy Ricch","dodger blue (feat. wallie the sensei, siete7x, roddy ricch)","pgLang, under exclusive license to Interscope Records",13,59,10,"1932715"
83,"spotify:track:1LmkdWSxjCV7wKTPsCvYWN","Laufey","Winter Wonderland - Spotify Singles Holiday","Laufey",43,138,14,"1918832"
84,"spotify:track:3i8fIJNV0yuC4kXT3SkVBZ","Ariana Grande","Popular","Universal Studios and Republic Records",79,86,10,"1918486"
85,"spotify:track:02CrqOYzrJR8fYOffhvRZZ","ROSÉ","number one girl","Atlantic Records",31,76,10,"1902955"
86,"spotify:track:5S8VwnB4sLi6W0lYTWYylu","Kendrick Lamar, Dody6","hey now (feat. dody6)","pgLang, under exclusive license to Interscope Records",8,62,10,"1896533"
87,"spotify:track:1UHS8Rf6h5Ar3CDWRd3wjF","Sabrina Carpenter","Bed Chem","Island Records",9,73,101,"1882527"
88,"spotify:track:19XpFsce28aByvCC4g89tJ","Hozier","Too Sweet","Rubyworks / Universal-Island Records Ltd",2,71,255,"1882077"
89,"spotify:track:6Qyc6fS4DsZjB2mRW9DsQs","The Goo Goo Dolls","Iris","Warner Records",32,80,444,"1871142"
90,"spotify:track:0RgjEkSbeuStKfT2Pa4Zai","Kendrick Lamar","reincarnated","pgLang, under exclusive license to Interscope Records",10,61,10,"1860182"
91,"spotify:track:550rQQCGkrTzvp4SfpOPzx","Pentatonix","Hallelujah","RCA Records Label",37,157,66,"1859658"
92,"spotify:track:4VXIryQMWpIdGgYR4TrjT1","Juice WRLD","All Girls Are The Same","Juice WRLD Mixtape / ISR P&D",22,74,614,"1825774"
93,"spotify:track:1BxfuPKGuaTgP7aM0Bbdwr","Taylor Swift","Cruel Summer","Taylor Swift",2,65,665,"1817970"
94,"spotify:track:3QiAAp20rPC3dcAtKtMaqQ","Elvis Presley","Blue Christmas","RCA Victor",21,143,165,"1813359"
95,"spotify:track:11P4sSu6BH2lAbWk1sL6cK","Elton John","Step Into Christmas - Remastered 1995","EMI",19,176,122,"1803153"
96,"spotify:track:4HEOgBHRCExyYVeTyrXsnL","Frank Sinatra","Jingle Bells - Remastered 1999","Capitol Records",25,136,75,"1797697"
97,"spotify:track:2HRgqmZQC0MC7GeNuDIXHN","Jung Kook, Latto","Seven (feat. Latto) (Explicit Ver.)","BIGHIT MUSIC",1,93,507,"1790636"
98,"spotify:track:2pnPe4pJtq7689i5ydzvJJ","Chuck Berry","Run Rudolph Run","Geffen*",27,140,118,"1788990"
99,"spotify:track:42VsgItocQwOQC3XWZ8JNA","Travis Scott, Playboi Carti","FE!N (feat. Playboi Carti)","Cactus Jack/Epic",3,72,448,"1773624"
100,"spotify:track:3D06dCZbYilOFAB8kR5tYF","MC LUUKY, DJ JB Mix","Malvadinho","EDITORA E GRAVADORA A BASE RECORDS",100,100,16,"1767751"
101,"spotify:track:2FPfeYlrbSBR8PwCU0zaqq","Frank Sinatra","Have Yourself A Merry Little Christmas - Remastered 1999","Capitol Records",39,172,21,"1766417"
102,"spotify:track:3VTNVsTTu05dmTsVFrmGpK","The Pogues, Kirsty MacColl","Fairytale of New York (feat. Kirsty MacColl)","WM UK",18,196,164,"1761240"
103,"spotify:track:0yc6Gst2xkRu0eMLeRMGCX","Cigarettes After Sex","Apocalypse","Partisan Records",52,107,846,"1744423"
104,"spotify:track:0eaVIYo2zeOaGJeqZ5TwYz","Don Toliver","No Pole","Cactus Jack / Atlantic",104,184,20,"1736045"
105,"spotify:track:1JSTJqkT5qHq8MDJnJbRE1","The Police","Every Breath You Take","Polydor Records",52,108,1145,"1702774"
106,"spotify:track:2CspwnypzT7rcWI9RfsoSb","JENNIE","Mantra","OA Entertainment/Columbia",5,104,52,"1698531"
107,"spotify:track:2N0SPREDYqILVEFSsWF5N5","V","Love Me Again","BIGHIT MUSIC",10,89,479,"1693984"
108,"spotify:track:4Yg2w0P29BBBMixyeNjDtj","Band Aid","Do They Know It's Christmas? - 1984 Version","EMI",3,-1,220,"1678461"
109,"spotify:track:2esZG2XFtuoWWA9AfDvSxy","FloyyMenor, Cris Mj","Gata Only","FloyyMenor under exclusive license to UnitedMasters LLC",2,84,294,"1675235"
110,"spotify:track:7bywjHOc0wSjGGbj04XbVi","Feid, ATL Jacob","LUNA","UMLE - Latino",7,69,363,"1674804"
111,"spotify:track:3hxIUxnT27p5WcmjGUXNwx","Hotel Ugly","Shut up My Moms Calling","Hotel Ugly, under exclusive license to Amuseio AB",63,124,683,"1670049"
112,"spotify:track:7eGuPhpdS8sBjPJNuAShUX","Ariana Grande, Cynthia Erivo","What Is This Feeling?","Universal Studios and Republic Records",107,120,7,"1660382"
113,"spotify:track:1foCxQtxBweJtZmdxhEHVO","Eartha Kitt, Henri René and His Orchestra","Santa Baby (with Henri René & His Orchestra)","RCA Bluebird",30,164,84,"1655534"
114,"spotify:track:58ge6dfP91o9oXMzq3XkIS","Arctic Monkeys","505","Domino Recording Co",40,98,1066,"1649451"
115,"spotify:track:0Sr7ssScx54yxdM2ols7nW","Omar Courtz, De La Rose","Q U E V A S H A C E R H O Y ?","Mr. 305 Records / Rimas Entertainment",11,78,66,"1638573"
116,"spotify:track:5TTGoX70AFrTvuEtqHK37S","Arctic Monkeys","No. 1 Party Anthem","Domino Recording Co",95,123,24,"1633981"
117,"spotify:track:60a0Rd6pjrkxjPbaKzXjfq","Linkin Park","In the End","Warner Records",7,82,562,"1629824"
118,"spotify:track:3qrTll9OQ9wcejTxPFY0qg","Twenty One Pilots, Arcane, League of Legends","The Line (from the series Arcane League of Legends)","Riot Games",68,103,8,"1620478"
119,"spotify:track:6AI3ezQ4o3HUoP6Dhudph3","Kendrick Lamar","Not Like Us","Kendrick Lamar, under exclusive license to Interscope Records",1,90,211,"1612934"
120,"spotify:track:25leEEaz1gIpp7o21Fqyjo","Gene Autry","Here Comes Santa Claus (Right Down Santa Claus Lane) - 1947 Version","Columbia/Legacy",40,-1,31,"1606936"
121,"spotify:track:3yDRcs0Y4pPzkvMbUfeF9H","LISA","Moonlit Floor (Kiss Me)","Lloud Co./RCA Records",9,91,59,"1606482"
122,"spotify:track:1SGvjfc85yzqKXsfKcCxn2","Kendrick Lamar","heart pt. 6","pgLang, under exclusive license to Interscope Records",14,92,10,"1599189"
123,"spotify:track:7MXVkk9YMctZqd1Srtv4MB","The Weeknd, Daft Punk","Starboy","Universal Republic Records",1,105,1519,"1595736"
124,"spotify:track:2nSjVyGwkGehPs6yQw1ztC","The Weavers","We Wish You A Merry Christmas","Geffen",13,-1,206,"1587697"
125,"spotify:track:3JG1uFc40wfyrqaWC7iv0e","Artemas","i like the way you kiss me","Artemas",1,106,257,"1586754"
126,"spotify:track:6s1kzj4EbhFLXbuAGJbhbn","MC Tuto, DJ Glenner","Barbie","Sonar Music",23,85,41,"1586127"
127,"spotify:track:6yzNzQxqsIY3zRsTwzLI3v","Bing Crosby, The Andrews Sisters","Mele Kalikimaka - New mono-to-stereo mix","Good Music",39,191,28,"1583663"
128,"spotify:track:7qiZfU4dY1lWllzX7mPBI3","Ed Sheeran","Shape of You","Atlantic Records UK",1,137,2381,"1582264"
129,"spotify:track:0YWUHZPJVg4iujddsJDwhM","Britney Spears","My Only Wish (This Year)","Jive",29,-1,131,"1580196"
130,"spotify:track:3nHuKdFJZm78CoeBnDcFKe","Teddy Swims","Bad Dreams","Warner Records",77,81,31,"1578641"
131,"spotify:track:2aYZaN5SmkRDLsrrV8GkBQ","Peso Pluma, Neton Vega","LA PATRULLA","2024 Double P Records",29,101,160,"1565772"
132,"spotify:track:7BRD7x5pt8Lqa1eGYC4dzj","Billie Eilish","CHIHIRO","Darkroom/Interscope Records",3,121,199,"1564228"
133,"spotify:track:0IsIY8pfu1yaGkPUD7pkDx","Charli xcx, Billie Eilish","Guess featuring billie eilish","Atlantic Records",3,141,122,"1561638"
134,"spotify:track:4iZ4pt7kvcaH6Yo8UoZ4s2","SZA","Snooze","Top Dawg Entertainment/RCA Records",25,119,654,"1542698"
135,"spotify:track:3xKsf9qdS1CyvXSMEid6g8","Frank Ocean","Pink + White","Boys Don't Cry",52,118,552,"1536867"
136,"spotify:track:7jtQIBanIiJOMS6RyCx6jZ","Tom Odell","Another Love","ITNO/Columbia",11,122,1327,"1533755"
137,"spotify:track:5IZXB5IKAD2qlvTPJYDCFB","Post Malone, Morgan Wallen","I Had Some Help (Feat. Morgan Wallen)","Mercury Records / Republic Records",1,110,206,"1533400"
138,"spotify:track:3be9ACTxtcL6Zm4vJRUiPG","yung kai","blue","BMG Rights Management (US) LLC",138,-1,1,"1526420"
139,"spotify:track:5ho7VSXSmI2KM2nDjcnLyz","Kendrick Lamar","man at the garden","pgLang, under exclusive license to Interscope Records",9,94,10,"1524600"
140,"spotify:track:5AJ9hqTS2wcFQCELCFRO7A","Tommy Richman","MILLION DOLLAR BABY","PULSE Records",1,134,220,"1523871"
141,"spotify:track:21B4gaTWnTkuSh77iWEXdS","Sabrina Carpenter","Juno","Island Records",22,116,101,"1523705"
142,"spotify:track:3M0lSi5WW79CXQamgSBIjx","Chase Atlantic","Swim","Warner Records",101,-1,57,"1519835"
143,"spotify:track:4SqWKzw0CbA05TGszDgMlc","The Walters","I Love You So","Warner Records",18,131,932,"1519596"
144,"spotify:track:6HrALJOMsfPCCbUo5cJCON","Tito Double P, Chino Pacas","ESCAPATE","2024 Double P Records",38,99,85,"1519159"
145,"spotify:track:2LBqCSwhJGcFQeTHMVGwy3","The Weeknd","Die For You","Universal Republic Records",9,128,1033,"1509967"
146,"spotify:track:0wgOhYnqZKjOHr6bmdz0aN","Kendrick Lamar, SZA","gloria (with sza)","pgLang, under exclusive license to Interscope Records",23,113,10,"1492133"
147,"spotify:track:2SR0alFA2oWYXSoePGTj0V","Jin","I’ll Be There","BIGHIT MUSIC",9,152,38,"1483146"
148,"spotify:track:2O3MQ6H3gjrIWDcpeTrikT","Kelly Clarkson, Ariana Grande","Santa, Can’t You Hear Me","Atlantic Records",32,-1,43,"1471241"
149,"spotify:track:0VjIjW4GlUZAMYd2vXMi3b","The Weeknd","Blinding Lights","Republic Records",1,111,1830,"1469520"
150,"spotify:track:3bMfUUpzUzqWp9II00yRhE","Vince Guaraldi Trio","Christmas Time Is Here","Fantasy Records",31,-1,23,"1461279"
151,"spotify:track:2Uts1QFB4u2YNIMiqcb4de","Kendrick Lamar, Az Chike","peekaboo (feat. azchike)","pgLang, under exclusive license to Interscope Records",15,109,10,"1460051"
152,"spotify:track:2nLtzopw4rPReszdYBJU6h","Linkin Park","Numb","Warner Records",12,117,264,"1459957"
153,"spotify:track:4xdBrk0nFZaP54vvZj0yx7","Chappell Roan","HOT TO GO!","Chappell Roan PS/ Island",19,129,174,"1454593"
154,"spotify:track:7Cnpb1vBbC46RgVyyKLH7p","aespa","Whiplash","aespa",33,173,42,"1450102"
155,"spotify:track:0eCajpR75pDW0r64U6hP2x","Anuv Jain","Jo Tum Mere Ho","Universal Music India Pvt. Ltd. (on behalf of Anuv Jain)",55,171,78,"1432481"
156,"spotify:track:1lOe9qE0vR9zwWQAOk6CoO","Lil Tecca","Ransom","Republic Records",3,139,441,"1425407"
157,"spotify:track:0u2P5u6lvoDfwTYjAADbn4","Billie Eilish, Khalid","lovely (with Khalid)","Darkroom",19,150,2405,"1421772"
158,"spotify:track:42wdz3j7gstgUuhoFLCXqd","FloyyMenor","PELIGROSA","FloyyMenor under exclusive license to UnitedMasters LLC",23,135,111,"1403500"
159,"spotify:track:0tgVpDi06FyKpA1z0VMD4v","Ed Sheeran","Perfect","Atlantic Records UK",3,161,2628,"1403270"
160,"spotify:track:3mg9jYNC1NihbthlglzrWP","KAROL G, Feid, DFZM, Ovy On The Drums, J Balvin, Maluma, Ryan Castro, Blessd","+57","Bichota/Interscope Records",15,112,24,"1401716"
161,"spotify:track:5xlS0QkVrSH7ssEbBgBzbM","The Beach Boys","Little Saint Nick - 1991 Remix","Capitol Records",27,-1,56,"1401224"
162,"spotify:track:5e0b9LgOfi3aJSKXFcOWRe","Chezile","Beanie","Chezile / 10K Projects",131,165,16,"1396174"
163,"spotify:track:0NsGFMIo2aNbAkJu48ndaf","Chino Pacas","Morena Canela","Street Mob Records/PFL/Geffen Records",127,127,13,"1395440"
164,"spotify:track:5uCax9HTNlzGybIStD3vDh","James Arthur","Say You Won't Let Go","Columbia",7,185,2312,"1385133"
165,"spotify:track:1QoyuMHNBe7lg3YW4Qtll4","Tyler, The Creator, Daniel Caesar","St. Chroma (feat. Daniel Caesar)","Columbia",3,162,35,"1383924"
166,"spotify:track:7lQ8MOhq6IN2w8EYcFNSUk","Eminem","Without Me","Aftermath",29,126,1155,"1383853"
167,"spotify:track:3Vr3zh0r7ALn8VLqCiRR10","Myles Smith","Stargazing","RCA Records Label",14,145,206,"1379583"
168,"spotify:track:7D0RhFcb3CrfPuTJ0obrod","Coldplay","Sparks","Parlophone UK",82,-1,149,"1373788"
169,"spotify:track:3p4hRhMcb6ch8OLtATMaLw","Cigarettes After Sex","Cry","Partisan Records",123,-1,30,"1365964"
170,"spotify:track:4Dvkj6JhhA12EX05fT7y2e","Harry Styles","As It Was","Columbia",1,149,977,"1364090"
171,"spotify:track:6dgUya35uo964z7GZXM07g","Sabrina Carpenter","Nonsense","Island Records",12,130,682,"1357409"
172,"spotify:track:62bOmKYxYg7dhrC6gH9vFn","*NSYNC","Bye Bye Bye - From Deadpool and Wolverine Soundtrack","Jive",8,144,129,"1354339"
173,"spotify:track:0mflMxspEfB0VbI1kyLiAv","Noah Kahan","Stick Season","Mercury Records/Republic Records",6,169,419,"1352374"
174,"spotify:track:70LcF31zb1H0PyJoS1Sx1r","Radiohead","Creep","XL Recordings",93,175,374,"1351184"
175,"spotify:track:45fQJ2FM2yyxgGupZWgW7s","Juice WRLD","Misfit","Grade A Productions/Interscope Records",59,155,3,"1347806"
176,"spotify:track:6pheMGrfMwwnypqafU7d4k","Mark Ambor","Run Rudolph Run - Spotify Singles Holiday","Hundred Days Records, LLC",176,-1,1,"1342696"
177,"spotify:track:7DSAEUvxU8FajXtRloy8M0","Miley Cyrus","Flowers","Columbia",1,125,684,"1336533"
178,"spotify:track:0B7wvvmu9EISAwZnOpjhNI","Bruno Mars","When I Was Your Man","Atlantic Records",28,170,743,"1336165"
179,"spotify:track:5Y35SjAfXjjG0sFQ3KOxmm","SZA","Nobody Gets Me","Top Dawg Entertainment/RCA Records",7,190,235,"1335429"
180,"spotify:track:161DnLWsx1i3u1JT05lzqU","Bruno Mars","Talking to the Moon","Elektra (NEK)",42,-1,425,"1334470"
181,"spotify:track:3GCdLUSnKSMJhs4Tj6CV3s","Kendrick Lamar, SZA","All The Stars (with SZA)","Black Panther (TDE/DMG) PS",2,147,545,"1334185"
182,"spotify:track:2hrycoFU1mZw6YPvMcn8yC","Jordan Adetunji","KEHLANI","300 Entertainment",33,-1,132,"1333173"
183,"spotify:track:3EaJDYHA0KnX88JvDhL9oa","Steve Lacy","Dark Red","Three Quarter",58,-1,853,"1325083"
184,"spotify:track:2eAvDnpXP5W0cVtiI0PUxV","Ruth B.","Dandelions","Columbia",32,-1,1104,"1323661"
185,"spotify:track:3siwsiaEoU4Kuuc9WKMUy5","The Marías","No One Noticed","Nice Life/Atlantic",97,188,27,"1320852"
186,"spotify:track:2tpWsVSb9UEmDRxAl1zhX1","OneRepublic","Counting Stars","Mosley / Interscope",78,163,1326,"1317122"
187,"spotify:track:6MzofobZt2dm0Kf1hTThFz","Addison Rae","Diet Pepsi","Columbia",28,180,91,"1310901"
188,"spotify:track:2HBBM75Xv3o2Mqdyh1NcM0","Linkin Park","Heavy Is the Crown","Warner Records",9,159,69,"1310448"
189,"spotify:track:2xGO2UjzxeVQSIkyg98vck","Queen","Thank God It's Christmas - Non-Album Single","EMI",25,-1,80,"1304610"
190,"spotify:track:6dBUzqjtbnIa1TwYbyw5CM","TV Girl","Lovers Rock","TV Girl",92,194,498,"1300488"
191,"spotify:track:7qEHsqek33rTcFNT9PFqLf","Lewis Capaldi","Someone You Loved","Vertigo Berlin",4,158,2142,"1299903"
192,"spotify:track:6RUKPb4LETWmmr3iAEQktW","The Chainsmokers, Coldplay","Something Just Like This","Disruptor Records/Columbia",2,151,1640,"1299561"
193,"spotify:track:2uqYupMHANxnwgeiXTZXzd","Dasha","Austin (Boots Stop Workin')","Warner Records",17,154,267,"1297640"
194,"spotify:track:0RiRZpuVRbi7oqRdSMwhQY","Post Malone, Swae Lee","Sunflower - Spider-Man: Into the Spider-Verse","Republic Records",1,156,2179,"1296954"
195,"spotify:track:4xqrdfXkTW4T0RauPLv3WA","Conan Gray","Heather","Republic Records",11,-1,1038,"1293955"
196,"spotify:track:1wubETHu3SeJHfbz9itEH0","Henrique & Juliano","Última Saudade - Ao Vivo","Virgin Music Label And Artist Services (S&D)",105,146,20,"1291694"
197,"spotify:track:5xeSd4HgzrYpNLEf3LfYLK","GloRilla, Sexyy Red","WHATCHU KNO ABOUT ME (feat. Sexyy Red)","CMG/Interscope Records",121,148,12,"1290191"
198,"spotify:track:3QIoEi8Enr9uHffwInGIsC","Eagles","Please Come Home for Christmas - 2013 Remaster","Rhino/Elektra",31,-1,42,"1289223"
199,"spotify:track:1RMJOxR6GRPsBHL8qeC2ux","Daniel Caesar, H.E.R.","Best Part (feat. H.E.R.)","Golden Child Recordings",84,-1,195,"1289112"
200,"spotify:track:3PIDciSFdrQxSQSihim3hN","Mariah Carey","Christmas (Baby Please Come Home)","Columbia",31,-1,114,"1278203"
