rank,uri,artist_names,track_name,source,peak_rank,previous_rank,weeks_on_chart,streams
1,"spotify:track:2XW4DbS6NddZxRPm5rMCeY","Drake","God's Plan","Cash Money/Drake LP6",1,1,5,"53416337"
2,"spotify:track:2Imq77E6CEJR5TPUxlJvTY","Kendrick Lamar, SZA","All The Stars (with SZA)","Black Panther (TDE/DMG) PS",2,2,7,"30168080"
3,"spotify:track:6tHWl8ows5JOZq9Yfaqn3M","Bazzi","Mine","iamcosmic",3,7,5,"23666856"
4,"spotify:track:4ofvoCdXq99vpMZO4Cfp8x","The Weeknd, Kendrick Lamar","Pray For Me","Universal Republic Records",3,3,3,"22395543"
5,"spotify:track:76cy1WJvNGJTj78UqeA5zr","Dua Lipa","IDGAF","Urban",4,6,8,"21322467"
6,"spotify:track:2U7Hu2RaNQNRi7izoJyZaX","Post Malone, 21 Savage","rockstar (feat. 21 Savage)","Republic Records",1,4,23,"21291755"
7,"spotify:track:4qKcDkK6siZ7Jp1Jb4m0aL","BlocBoy JB, Drake","Look Alive (feat. Drake)","Bloc Nation",7,11,2,"19920253"
8,"spotify:track:1rfofaqEpACxVEHIZBJe6W","Camila Cabello, Young Thug","Havana (feat. Young Thug)","Syco Music/Epic",1,5,29,"19736610"
9,"spotify:track:2j2fIJGh4PMdXt9ULI5Tlc","Daddy Yankee","Dura","El Cartel Records (EC3)",9,10,5,"18068532"
10,"spotify:track:08bNPGLD8AhKpnnERrAc6G","Marshmello, Anne-Marie","FRIENDS","Atlantic Records UK",10,25,2,"17913457"
11,"spotify:track:09IStsImFySgyp0pIQdqAc","Zedd, Maren Morris, Grey","The Middle","UMGRI Interscope",11,12,4,"17897973"
12,"spotify:track:5UEnHoDYpsxlfzWLZIc7LD","Eminem, Ed Sheeran","River (feat. Ed Sheeran)","Aftermath",2,9,10,"17596221"
13,"spotify:track:5CLGzJsGqhCEECcpnFQA8x","Rudimental, Jess Glynne, Macklemore, Dan Caplen","These Days (feat. Jess Glynne, Macklemore & Dan Caplen)","Atlantic Records UK",13,15,5,"17508441"
14,"spotify:track:3Vo4wInECJQuz9BIBMOu8i","Bruno Mars, Cardi B","Finesse - Remix; feat. Cardi B","Atlantic Records",4,8,7,"16499044"
15,"spotify:track:2IKZkwHI5zsZf70STuhvOX","The Chainsmokers","Sick Boy","Disruptor Records/Columbia",14,22,5,"15514241"
16,"spotify:track:1zsG4eaZmkA1dvjDDsAGLK","Luis Fonsi, Demi Lovato","Échame La Culpa","UMLE - Latino",7,13,14,"15494467"
17,"spotify:track:4eWQlBRaTjPPUlzacqEeoQ","Camila Cabello","Never Be the Same","Syco Music/Epic",4,14,11,"15352945"
18,"spotify:track:3ITvHA9zhZZdBJsOsAUegF","Bad Bunny","Amorfoda","Rimas Entertainment LLC",18,-1,1,"14639577"
19,"spotify:track:2UVbBKQOdFAekPTRsnkzcf","Migos","Stir Fry","Quality Control Music, LLC",16,21,8,"14468212"
20,"spotify:track:0tgVpDi06FyKpA1z0VMD4v","Ed Sheeran","Perfect","Atlantic Records UK",4,17,51,"14209752"
21,"spotify:track:7EmGUiUaOSGDnUUQUDrOXC","Selena Gomez, Marshmello","Wolves","Selena Gomez PS",3,16,18,"14181680"
22,"spotify:track:2ekn2ttSfGqwhhate0LSR0","Dua Lipa","New Rules","Urban",2,18,33,"14158930"
23,"spotify:track:7iDa6hUg2VgEL1o1HjmfBn","Bebe Rexha, Florida Georgia Line","Meant to Be (feat. Florida Georgia Line)","Warner Records",21,23,23,"13973085"
24,"spotify:track:5k38wzpLb15YgncyWdTZE4","G-Eazy, Halsey","Him & I (with Halsey)","BPG/RVG/RCA Records",7,20,12,"13570902"
25,"spotify:track:45Egmo7icyopuzJN0oMEdk","Khalid, Normani","Love Lies","RCA Records Label",25,-1,1,"13554767"
26,"spotify:track:75ZvA4QfFiZvzhj2xkaWAh","Post Malone","I Fall Apart","Universal Records",10,24,22,"13291809"
27,"spotify:track:5hM6sP0Gh1jD57drszNueC","Liam Payne, Rita Ora","For You (With Rita Ora)","Capitol Records UK / EMI",27,34,7,"13208405"
28,"spotify:track:6mrKP2jyIQmM0rw6fQryjr","NF","Let You Down","NF Real Music",9,19,20,"12921452"
29,"spotify:track:51rXHuKN8Loc4sUlKPODgH","Jay Rock, Kendrick Lamar, Future, James Blake","King's Dead (with Kendrick Lamar, Future & James Blake)","Black Panther (TDE/DMG) PS",29,30,6,"12530784"
30,"spotify:track:4R55IUi2x7S5ek2SpebOiE","Wolfine","Bella","LOMIORECORDS",29,29,9,"12301198"
31,"spotify:track:5AEtlRudpgdT5FtNiuly6Y","Hailee Steinfeld, Alesso, Florida Georgia Line, WATT","Let Me Go (with Alesso, Florida Georgia Line & watt)","Universal Records",16,26,24,"12126692"
32,"spotify:track:7qiZfU4dY1lWllzX7mPBI3","Ed Sheeran","Shape of You","Atlantic Records UK",1,27,59,"12124920"
33,"spotify:track:4lESS6vuruP6a79KWRaQou","Maluma, Nego do Borel","Corazón (feat. Nego do Borel)","Sony Music Latin",17,31,16,"11454758"
34,"spotify:track:2xmrfQpmS2iJExTlklLoAL","Clean Bandit, Julia Michaels","I Miss You (feat. Julia Michaels)","Atlantic Records UK",23,32,17,"11311372"
35,"spotify:track:3towKHKVOXCCcL1fHv6xFO","Hailee Steinfeld, BloodPop®","Capital Letters","Republic/Universal/FSF",35,55,5,"11155603"
36,"spotify:track:33bnxcjePIkcmNjEFTJX0l","Piso 21, Manuel Turizo","Déjala Que Vuelva (feat. Manuel Turizo)","WM Mexico",33,36,16,"10995579"
37,"spotify:track:3Ga6eKrUFf12ouh9Yw3v2D","Anitta, J Balvin","Downtown","WM Brazil",21,35,14,"10849879"
38,"spotify:track:1LhMopPAallLeaeNutqbgS","Justin Timberlake, Chris Stapleton","Say Something (feat. Chris Stapleton)","RCA Records Label",25,37,4,"10740439"
39,"spotify:track:6Za3190Sbw39BBC77WSS1C","NATTI NATASHA, Ozuna","Criminal","Pina Records",21,40,23,"10556847"
40,"spotify:track:630sXRhIcfwr2e4RdNtjKN","Zac Efron, Zendaya","Rewrite The Stars","Atlantic Records",20,33,8,"10288625"
41,"spotify:track:7vGuf3Y35N4wmASOKLUVVU","Marshmello, Khalid","Silence","Joytime Collective/RCA Records",8,41,28,"10256888"
42,"spotify:track:4LmAnpjlhWTahvRkYR8xJa","ScHoolboy Q, 2 Chainz, Saudi","X (with 2 Chainz & Saudi)","Black Panther (TDE/DMG) PS",28,28,2,"10009254"
43,"spotify:track:5jyyPsIGM2yqkZN9R3TmvN","Khalid, Swae Lee","The Ways (with Swae Lee)","Black Panther (TDE/DMG) PS",38,38,2,"9894231"
44,"spotify:track:3hBBKuWJfxlIlnd9QFoC8k","Maroon 5, SZA","What Lovers Do (feat. SZA)","Interscope Records*",5,39,25,"9885743"
45,"spotify:track:2xGjteMU3E1tkEPVFBO08U","Keala Settle, The Greatest Showman Ensemble","This Is Me","Atlantic Records",30,43,8,"9795918"
46,"spotify:track:6QgjcU0zLnzq5OrUoSZ3OK","Portugal. The Man","Feel It Still","Atlantic Records",18,44,32,"9723542"
47,"spotify:track:1mXVgsBdtIVeCLJnSnmtdV","Sam Smith","Too Good At Goodbyes","PLG - Capitol",1,42,24,"9704921"
48,"spotify:track:5VnDkUNyX6u5Sk0yZiP8XB","Imagine Dragons","Thunder","Kid Ina Korner / Interscope",8,46,43,"9532196"
49,"spotify:track:5hcisvFMidkMJlElTO9Qmw","Bad Bunny, Prince Royce, J Balvin, Mambo Kingz, DJ Luian","Sensualidad","Hear This Music",21,48,16,"9390882"
50,"spotify:track:7GX5flRQZVHRAGd6B4TmDO","Lil Uzi Vert","XO Tour Llif3","Generation Now/Atlantic",10,50,48,"9182439"
51,"spotify:track:0wbnC9AUenxp613TYaJsGK","Migos","Narcos","Quality Control Music, LLC",24,45,4,"8635931"
52,"spotify:track:2vvdTrdryjsl8DmPIMDWZU","Enrique Iglesias, Bad Bunny","EL BAÑO","RCA Records/Sony Music International/Sony Music Latin",38,52,6,"8495935"
53,"spotify:track:7sO5G9EABYOXQKNPNiE9NR","Offset, Metro Boomin","Ric Flair Drip (with Metro Boomin)","Slaughter Gang, LLC/Epic/Quality Control Music/Motown/Capitol/Boominati Worldwide/Republic",32,53,17,"8466568"
54,"spotify:track:4QfNOZN7vrQCQKK1ZJ3XPb","Julia Michaels","Heaven - From ""Fifty Shades Freed"" Soundtrack","UME - Global Clearing House",54,82,2,"8330083"
55,"spotify:track:2z4pcBLQXF2BXKFvd0BuB6","Jason Derulo, French Montana","Tip Toe (feat. French Montana)","Beluga Heights/Warner Records",45,54,15,"8242307"
56,"spotify:track:7KXjTSCq5nL1LoYtL7XAwS","Kendrick Lamar","HUMBLE.","Aftermath",1,58,47,"8123078"
57,"spotify:track:1bhUWB0zJMIKr9yVPrkEuI","Ed Sheeran, Beyoncé","Perfect Duet (Ed Sheeran & Beyoncé)","Atlantic Records UK",3,49,12,"8015800"
58,"spotify:track:0OlnLZY4cmQzT6ZGttvWBM","Martin Garrix, David Guetta, Jamie Scott, Romy Dya","So Far Away (feat. Jamie Scott & Romy Dya)","Epic Amsterdam",42,63,12,"7924787"
59,"spotify:track:5Z3GHaZ6ec9bsiI5BenrbY","Khalid","Young Dumb & Broke","Right Hand Music Group, LLC/RCA Records",12,60,35,"7894637"
60,"spotify:track:6PGoSes0D9eUDeeAafB2As","Kendrick Lamar, Zacari","LOVE. FEAT. ZACARI.","Aftermath",14,61,45,"7878187"
61,"spotify:track:3a1lNhkSLSkpJE4MSHpDu9","Post Malone, Quavo","Congratulations","Universal Records",20,64,57,"7863361"
62,"spotify:track:1j4kHkkpqZRBwE0A4CN4Yv","ZAYN, Sia","Dusk Till Dawn (feat. Sia) - Radio Edit","RCA Records Label",4,56,24,"7834233"
63,"spotify:track:2DQ1ITjI0YoLFzuADN1ZBW","G-Eazy, A$AP Rocky, Cardi B","No Limit","BPG/RVG/RCA Records",18,57,21,"7615549"
64,"spotify:track:6NWl2m8asvH83xjuXVNsuG","Lil Xan","Betrayed","Columbia",55,67,16,"7561797"
65,"spotify:track:7EI6Iki24tBHAMxtb4xQN2","Rita Ora","Anywhere","Atlantic Records UK",39,65,18,"7549912"
66,"spotify:track:6MNGxu8MprKGkchUchkJsy","J Balvin, Jeon, Anitta","Machika","UMLE - Latino",63,69,5,"7270985"
67,"spotify:track:5Y9fnynLlIvqtM710MHzfz","Ozuna","Síguelo Bailando","VP Records Corp/Dimelo Vi",67,85,8,"7262436"
68,"spotify:track:75FDPwaULRdYDn4StFN2rT","Cardi B, 21 Savage","Bartier Cardi (feat. 21 Savage)","KSR/Atlantic",22,59,9,"7244062"
69,"spotify:track:32DGGj6KlNuBr6WaqRxpxi","Charlie Puth","How Long","Artist Partner",15,68,20,"7080696"
70,"spotify:track:1USJRpWDFhxwhCajPXBeel","The Chainsmokers","You Owe Me","Disruptor Records/Columbia",70,-1,1,"7077874"
71,"spotify:track:42CeaId2XNlxugDvyqHfDf","Post Malone","Candy Paint","Republic Records",17,66,23,"6956257"
72,"spotify:track:5cXg9IQS34FzLVdHhp7hu7","Kendrick Lamar, Travis Scott","Big Shot (with Travis Scott)","Black Panther (TDE/DMG) PS",51,51,2,"6903157"
73,"spotify:track:4zWO4gvuFtw6EJZC5FFGlr","MC Fioti, J Balvin, Stefflon Don, Future, Juan Magán","Bum Bum Tam Tam","Kontor Records",66,70,10,"6898051"
74,"spotify:track:1NtIMM4N0cFa1dNzN15chl","Imagine Dragons","Believer","Kid Ina Korner / Interscope",16,79,55,"6839256"
75,"spotify:track:7rwX0O3RlxqqIjQM8evm5E","Ozuna, Mambo Kingz, DJ Luian, Bad Bunny, Wisin, Almighty","Solita","Hear This Music",75,89,4,"6811201"
76,"spotify:track:3B54sVLJ402zGa6Xm4YGNe","French Montana, Swae Lee","Unforgettable","Bad Boy Entertainment/Epic Records",3,75,46,"6805292"
77,"spotify:track:6De0lHrwBfPfrhorm9q1Xl","Danny Ocean","Me Rehúso","Atlantic Records",20,78,53,"6777802"
78,"spotify:track:1m69ELEgE6k5ZWsap40ozt","Ozuna","Se Preparó","VP Records Corp/Dimelo Vi",30,74,26,"6764678"
79,"spotify:track:2EzRdhuoPyNJDlep7lnNf2","Danny Ocean","Dembow","Atlantic Records",79,97,6,"6719957"
80,"spotify:track:5WoaF1B5XIEnWfmb5NZikf","Miguel, Travis Scott","Sky Walker (feat. Travis Scott)","ByStorm Entertainment/RCA Records",69,80,14,"6657693"
81,"spotify:track:43ZyHQITOjhciSUUNPVRHc","Lil Pump","Gucci Gang","Warner Records",6,72,24,"6611158"
82,"spotify:track:2tPcTFiQF9MbVUyjZ3zDhA","SOB X RBE","Paramedic!","Black Panther (TDE/DMG) PS",62,62,2,"6602548"
83,"spotify:track:2fQrGHiQOvpL9UgPvtYy6G","21 Savage","Bank Account","Slaughter Gang, LLC/Epic Records",22,81,33,"6481844"
84,"spotify:track:2rb5MvYT7ZIxbKW5hfcHx8","J Balvin, Willy William","Mi Gente","Columbia/B1 Recordings",1,77,34,"6439251"
85,"spotify:track:4wFjTWCunQFKtukqrNijEt","Migos, Nicki Minaj, Cardi B","MotorSport","Quality Control Music, LLC",34,73,17,"6428889"
86,"spotify:track:1wjzFQodRWrPcQ0AnYnvQ9","Lauv","I Like Me Better","Lauv",29,88,38,"6303564"
87,"spotify:track:3ncgNpxLoBQ65ABk4djDyd","Famous Dex, A$AP Rocky","PICK IT UP (feat. A$AP Rocky)","300 Entertainment",60,71,15,"6267158"
88,"spotify:track:5HwnezK198pJCEj1l2Adjy","Camila Cabello","She Loves Control","Syco Music/Epic",53,87,6,"6262958"
89,"spotify:track:4iLqG9SeJSnt0cSPICSjxv","Charlie Puth","Attention","Artist Partner",5,83,44,"6215484"
90,"spotify:track:5yFSF6qQA1rcLsQRnBsZgb","Alan Walker, Noah Cyrus, Digital Farm Animals, Juliander","All Falls Down (feat. Juliander)","Kreatell Music",52,86,17,"6189494"
91,"spotify:track:6RUKPb4LETWmmr3iAEQktW","The Chainsmokers, Coldplay","Something Just Like This","Disruptor Records/Columbia",2,96,53,"6163210"
92,"spotify:track:5tz69p7tJuGPeMGwNTxYuV","Logic, Alessia Cara, Khalid","1-800-273-8255","Def Jam Recordings",5,84,43,"6151301"
93,"spotify:track:5uCax9HTNlzGybIStD3vDh","James Arthur","Say You Won't Let Go","Columbia",7,91,61,"6059767"
94,"spotify:track:4dVpf9jZjcORqGTLUaeYj9","A$AP Ferg","Plain Jane","RCA Records Label",37,92,23,"6039875"
95,"spotify:track:0MIcPSq9n2z5H8TAfEstri","Ozuna, J Balvin","Quiero Repetir","VP Records Corp/Dimelo Vi",86,95,8,"5962532"
96,"spotify:track:7JNh1cfm0eXjqFVOzKLyau","Becky G, Bad Bunny","Mayores","Kemosabe Records/RCA Records/Sony Music Latin",33,94,30,"5955012"
97,"spotify:track:2u7mxWSeoqTXndK5e08jMp","Lil Skies, Landon Cube","Nowadays (feat. Landon Cube)","All We Got Ent.",97,106,7,"5945380"
98,"spotify:track:3m660poUr1chesgkkjQM7P","Demi Lovato","Sorry Not Sorry","Island Records",7,100,33,"5939764"
99,"spotify:track:7m9OqQk4RVRkw9JJdeAw96","XXXTENTACION","Jocelyn Flores","Bad Vibes Forever / EMPIRE",15,101,26,"5922359"
100,"spotify:track:7krbSH3rd8lhIZvuzTV3Bl","James Arthur","Naked","Columbia Local",86,93,13,"5805318"
101,"spotify:track:152lZdxL1OR0ZMW6KquMif","Khalid","Location","Right Hand Music Group, LLC/RCA Records",34,104,55,"5795699"
102,"spotify:track:0Zbbxnx4SGGHoIow4PpISP","Kygo, Justin Jesso","Stargazing","Kygo",15,99,22,"5791251"
103,"spotify:track:2771LMNxwf62FTAdpJMQfM","Cardi B","Bodak Yellow","KSR/Atlantic",21,98,30,"5691606"
104,"spotify:track:71bBFbfn2OBK5QwUJSLS44","Axwell /\ Ingrosso","More Than You Know","Pophouse Entertainment Group",15,105,39,"5636493"
105,"spotify:track:6n4U3TlzUGhdSFbUUhTvLP","Migos, Drake","Walk It Talk It","Quality Control Music, LLC",30,102,4,"5606805"
106,"spotify:track:2OALaHcDdKkjYEpAr0Qzab","Avicii, Rita Ora","Lonely Together (feat. Rita Ora)","Universal Music AB",19,103,28,"5603365"
107,"spotify:track:1nfyE13arjOuO54HH0zmqj","Manuel Turizo","Esperándote","Sony Music Latin/La Industria",107,108,5,"5504452"
108,"spotify:track:3xWEI23MLJrD0dpDcDUTW6","Juan Magán, Belinda, Manuel Turizo, Snova, B-Case","Déjate Llevar","Universal Music Spain S.L.",97,109,8,"5412555"
109,"spotify:track:6tvQzeCPwOytDlBYCIOY0n","Jax Jones, Ina Wroldsen","Breathe (feat. Ina Wroldsen)","Polydor Records",109,132,6,"5408583"
110,"spotify:track:6gBFPUFcJLzWGx4lenP6h2","Travis Scott","goosebumps","Cactus Jack / Epic",60,110,60,"5378614"
111,"spotify:track:5qN4HFkapdAOV94XPryVof","Kendrick Lamar","Black Panther","Black Panther (TDE/DMG) PS",47,47,2,"5374935"
112,"spotify:track:4pYZLpX23Vx8rwDpJCpPTA","Rich The Kid, Kendrick Lamar","New Freezer (feat. Kendrick Lamar)","Rich The Kid / (TDE/ISR PS)",112,135,9,"5351472"
113,"spotify:track:3VClLWqNn80Llv0PJOsKgr","Nacho, Yandel, Bad Bunny, Mambo Kingz, DJ Luian","Báilame - Remix","UMLE - Latino",58,117,27,"5305404"
114,"spotify:track:5TmZYdHW6HJ9gt7Aokuql5","Sebastian Yatra, Dalmata","SUTRA","UMLE - Latino",96,113,17,"5257629"
115,"spotify:track:0as7lPxkBPctZ7uVmchRNM","Cashmere Cat, Major Lazer, Tory Lanez","Miss You (with Major Lazer & Tory Lanez)","Benny Blanco Major",115,127,5,"5221910"
116,"spotify:track:6jA8JUuPCGYjFcgw0AoM5T","Reik, Ozuna, Wisin","Me Niego (feat. Ozuna & Wisin)","Columbia",116,-1,1,"5202066"
117,"spotify:track:5Htb1uFQ1KrkFXlefS8oGj","Demi Lovato","Tell Me You Love Me","Island Records",70,128,13,"5188945"
118,"spotify:track:7bUcBztfGqO7cSI2gMZeCI","Vince Staples, Yugen Blakrok","Opps (with Yugen Blakrok)","Black Panther (TDE/DMG) PS",76,76,2,"5186461"
119,"spotify:track:43ay9lQZ5rfNcOOHhRF2cM","Hugh Jackman, Keala Settle, Zac Efron, Zendaya, The Greatest Showman Ensemble","The Greatest Show","Atlantic Records",73,107,8,"5178973"
120,"spotify:track:7ofxPmTNMj2GP07g1VZa0O","Alex Sensation, Ozuna","Que Va","JP Entertainment (Jorge Pino)",54,111,26,"5165145"
121,"spotify:track:1xznGGDReH1oQq0xzbwXa3","Drake, Wizkid, Kyla","One Dance","Cash Money Records/Young Money Ent./Universal Rec.",12,143,61,"5060632"
122,"spotify:track:1x5sYLZiu9r5E43kMlt9f8","Clean Bandit, Zara Larsson","Symphony (feat. Zara Larsson)","Atlantic Records UK",11,122,49,"5057351"
123,"spotify:track:5TysCiZtv1HnSWcTcUFusI","Joey Montana, Sebastian Yatra","Suena El Dembow","UMLE - Latino",66,125,23,"4995823"
124,"spotify:track:2Tq2R8sRftNEqdgJK5HadO","Troye Sivan","My My My!","EMI Recorded Music Australia Pty Ltd",31,121,6,"4965757"
125,"spotify:track:7BKLCZ1jbUBVqRi2FVlTVw","The Chainsmokers, Halsey","Closer","Disruptor Records/Columbia",2,145,61,"4950504"
126,"spotify:track:73NbHgUZ51H65Bfo2HFKUi","Imagine Dragons","Whatever It Takes","Kid Ina Korner / Interscope",51,142,28,"4947491"
127,"spotify:track:5CtI0qwDJkDQGwXD1H1cLb","Luis Fonsi, Daddy Yankee, Justin Bieber","Despacito - Remix","UMLE - Latino",1,133,45,"4929980"
128,"spotify:track:1Slwb6dOYkBlWal1PGtnNg","Ed Sheeran","Thinking out Loud","Atlantic Records UK",58,112,61,"4925081"
129,"spotify:track:0lJCqIx5BhZtf6QtYI2fbv","Daddy Yankee, Bad Bunny","Vuelve","El Cartel Records (EC3)",71,140,20,"4920153"
130,"spotify:track:6EpRaXYhGOB3fj4V2uDkMJ","Liam Payne, Quavo","Strip That Down (feat. Quavo)","Capitol Records UK / EMI",9,126,40,"4908186"
131,"spotify:track:0KKkJNfGyhkQ5aFogxQAPU","Bruno Mars","That's What I Like","Atlantic Records",6,130,61,"4907416"
132,"spotify:track:6fxVffaTuwjgEk5h9QyRjy","Ed Sheeran","Photograph","Atlantic Records UK",41,119,61,"4900951"
133,"spotify:track:1yxgsra98r3qAtxqiGZPiX","Travis Scott","BUTTERFLY EFFECT","Cactus Jack / Epic",40,131,40,"4876469"
134,"spotify:track:4DTpngLjoHj5gFxEZFeD3J","Kodak Black, Lil Wayne","Codeine Dreaming (feat. Lil Wayne)","Atlantic Records",50,129,13,"4863923"
135,"spotify:track:0JcNysfWVWaMS7R6vzGB2k","Carlos Vives, Sebastian Yatra","Robarte un Beso","Sony Music Latin",61,136,29,"4827127"
136,"spotify:track:79cuOz3SPQTuFrp8WgftAu","Shawn Mendes","There's Nothing Holdin' Me Back","Island Records",5,137,44,"4809882"
137,"spotify:track:1KSqYYJFyfTecXFk9M0prc","Wisin, Ozuna","Escápate Conmigo (feat. Ozuna)","Sony Music Latin",38,115,46,"4771550"
138,"spotify:track:5lZsh9Qf7CbHI9Fcc7Zcsq","YBN Nahmir","Bounce Out With That","2018",138,158,3,"4751511"
139,"spotify:track:0RoA7ObU6phWpqhlC9zH4Z","Ziv Zaifman, Hugh Jackman, Michelle Williams","A Million Dreams","Atlantic Records",95,120,8,"4746578"
140,"spotify:track:0ERbK7qVqveCaBWIiYCrl3","Romeo Santos, Daddy Yankee, Nicky Jam","Bella y Sensual","Sony Music Latin",106,144,30,"4715951"
141,"spotify:track:0Gl5s8IhMmQE5YQwM8Qx1J","Loren Allred","Never Enough","Atlantic Records",92,124,8,"4687156"
142,"spotify:track:0qYTZCo5Bwh1nsUFGZP3zn","Maluma","Felices los 4","Sony Music Latin",17,138,44,"4686672"
143,"spotify:track:0DJBgBiYeSn6n1AXAkFVE8","Jorja Smith","I Am","Black Panther (TDE/DMG) PS",90,90,2,"4682965"
144,"spotify:track:70lnL3QaSOIIyMa2X9aVRL","Shakira, Nicky Jam","Perro Fiel (feat. Nicky Jam)","Sony Music Latin",46,118,20,"4615662"
145,"spotify:track:3NdDpSvN911VPGivFlV5d0","ZAYN, Taylor Swift","I Don’t Wanna Live Forever (Fifty Shades Darker)","Big Machine Records, LLC",2,141,61,"4522444"
146,"spotify:track:3whrwq4DtvucphBPUogRuJ","Camila Cabello, Daddy Yankee","Havana - Remix","Syco Music/Epic",50,146,14,"4517413"
147,"spotify:track:5mCPDVBb16L4XQwDdbRUpz","Drake","Passionfruit","Cash Money Records/Young Money Ent./Universal Rec.",2,171,48,"4498545"
148,"spotify:track:7vu0JkJh0ldukEYbTVcqd0","Julia Michaels","Issues","J/Republic",9,151,58,"4467805"
149,"spotify:track:5yuShbu70mtHXY0yLzCQLQ","Post Malone","Go Flex","Universal Records",52,156,33,"4447647"
150,"spotify:track:7AQim7LbvFVZJE3O8TYgf2","XXXTENTACION, Trippie Redd","Fuck Love","Bad Vibes Forever / EMPIRE",41,154,26,"4442908"
151,"spotify:track:1XRgIKC5TPwo7nWGyKqgG0","Gucci Mane, Migos","I Get the Bag (feat. Migos)","Guwop Enterprises/Atlantic",45,149,27,"4438278"
152,"spotify:track:0afhq8XCExXpqazXczTSve","Ed Sheeran","Galway Girl","Atlantic Records UK",2,155,51,"4391206"
153,"spotify:track:7nZmah2llfvLDiUjm0kiyz","Justin Bieber, BloodPop®","Friends (with BloodPop®)","BloodPop/DJ/RMBG/Republic",2,157,27,"4345260"
154,"spotify:track:3DXncPQOG4VBw3QHh3S817","DJ Khaled, Justin Bieber, Quavo, Chance the Rapper, Lil Wayne","I'm the One (feat. Justin Bieber, Quavo, Chance the Rapper & Lil Wayne)","Epic/We The Best",2,162,43,"4344873"
155,"spotify:track:0NiXXAI876aGImAd6rTj8w","Jonas Blue, William Singe","Mama","UMOD (Universal Music On Demand)",11,160,42,"4323979"
156,"spotify:track:790MhTXPFrYkrqCKvpg4t1","NAV, Lil Uzi Vert","Wanted You (feat. Lil Uzi Vert)","XO Records",99,152,15,"4278455"
157,"spotify:track:6HZILIRieu8S0iqY8kIKhj","Kendrick Lamar","DNA.","Aftermath",3,161,44,"4271384"
158,"spotify:track:3OnOomd79OjqSYHchCQ6ht","Migos, Post Malone","Notice Me","Quality Control Music, LLC",60,147,4,"4246920"
159,"spotify:track:7hvxMYq9JW5W0vFwiu1Zdr","Axwell /\ Ingrosso","Dreamer","Pophouse Entertainment Group",137,148,9,"4246916"
160,"spotify:track:0P6AWOA4LG1XOctzaVu5tt","SZA, Calvin Harris, Funk Wav","The Weekend - Funk Wav Remix","Top Dawg Entertainment/RCA Records",160,177,8,"4222747"
161,"spotify:track:40oKW22ZNNkEdZLJTScaQI","Kodak Black, XXXTENTACION","Roll in Peace (feat. XXXTENTACION)","Atlantic Records",79,164,27,"4203061"
162,"spotify:track:7w9bgPAmPTtrkt2v16QWvQ","Eminem","Lose Yourself","Aftermath",143,179,48,"4202700"
163,"spotify:track:3kxfsdsCpFgN412fpnW85Y","Childish Gambino","Redbone","Glassnote - VMG",35,163,61,"4186838"
164,"spotify:track:1OAh8uOEOvTDqkKFsKksCi","DJ Khaled, Rihanna, Bryson Tiller","Wild Thoughts (feat. Rihanna & Bryson Tiller)","Epic/We The Best",2,170,36,"4173757"
165,"spotify:track:2x0WlnmfG39ZuDmstl9xfX","Taylor Swift, Ed Sheeran, Future","End Game","Big Machine Records, LLC",47,123,12,"4168557"
166,"spotify:track:2cKovq3l6OJjhVVDbVKOsr","Hugh Jackman, Zac Efron","The Other Side","Atlantic Records",110,150,7,"4166251"
167,"spotify:track:5aAx2yezTd8zXrkmtKl66Z","The Weeknd, Daft Punk","Starboy","Universal Republic Records",1,175,61,"4160599"
168,"spotify:track:0VgkVdmE4gld66l8iyGjgx","Future","Mask Off","Epic/Freebandz/A1",5,172,53,"4145208"
169,"spotify:track:6u0EAxf1OJTLS7CvInuNd7","Anitta, ZAAC, Maejor, Tropkillaz, DJ Yuri Martins","Vai malandra (feat. Tropkillaz & DJ Yuri Martins)","WM Brazil",30,116,10,"4133127"
170,"spotify:track:5bcTCxgc7xVfSaMV3RuVke","Calvin Harris, Pharrell Williams, Katy Perry, Big Sean, Funk Wav","Feels (feat. Pharrell Williams, Katy Perry & Big Sean)","Columbia",5,174,36,"4124506"
171,"spotify:track:7uYgVgRSgqluZclLS7wpp4","Ozuna, Romeo Santos","El Farsante - Remix","VP Records Corp/Dimelo Vi",171,183,3,"4113952"
172,"spotify:track:1Qg9jWGDkKAGZXj5v2OG59","Maroon 5","Wait","Interscope Records*",74,182,16,"4098956"
173,"spotify:track:0Qh38w01QRXK6KHIv0e3hb","P!nk","What About Us","RCA Records Label",18,166,28,"4070774"
174,"spotify:track:0CokSRCu5hZgPxcZBaEzVE","Macklemore, Skylar Grey","Glorious (feat. Skylar Grey)","Bendo LLC",14,168,33,"4070381"
175,"spotify:track:4QtiVmuA88tPQiCOHZuQ5b","Sofía Reyes, Jason Derulo, De La Ghetto","1, 2, 3 (feat. Jason Derulo & De La Ghetto)","WEA Latina",175,-1,1,"4052789"
176,"spotify:track:7amMgNDcObIDkIXv4xcvc2","Ramz","Barking","Polydor Records",168,181,5,"4032607"
177,"spotify:track:3eR23VReFzcdmS7TYCrhCe","Kygo, Selena Gomez","It Ain't Me (with Selena Gomez)","Kygo",2,180,53,"4017575"
178,"spotify:track:0OI7AFifLSoGzpb8bdBLLV","mgk, X Ambassadors, Bebe Rexha","Home (with Machine Gun Kelly, X Ambassadors & Bebe Rexha)","Atlantic Records",66,167,13,"4008091"
179,"spotify:track:4aWmUDTfIPGksMNLV2rQP2","Luis Fonsi, Daddy Yankee","Despacito","UMLE - Latino",4,176,58,"3985641"
180,"spotify:track:0I20rLT2MJDhcF96AjbNYo","Zedd, Alessia Cara","Stay","UMGRI Interscope",7,178,52,"3966842"
181,"spotify:track:5qqabIl2vWzo9ApSC317sa","Oasis","Wonderwall - Remastered","Big Brother Recordings Ltd",152,200,22,"3942904"
182,"spotify:track:6kex4EBAj0WHXDKZMEJaaF","Jason Derulo, Nicki Minaj, Ty Dolla $ign","Swalla (feat. Nicki Minaj & Ty Dolla $ign)","Beluga Heights/Warner Records",6,186,52,"3920604"
183,"spotify:track:7MHN1aCFtLXjownGhvEQlF","Manuel Turizo","Una Lady Como Tú","Sony Music Latin/La Industria",38,189,38,"3867799"
184,"spotify:track:6yr8GiTHWvFfi4o6Q5ebdT","Eminem, Nate Dogg","Till I Collapse","Aftermath",157,191,25,"3864801"
185,"spotify:track:6lOWoTqVnAWXchddtTH31W","Tom Walker","Leave a Light On","Relentless Records",185,-1,1,"3864189"
186,"spotify:track:6eT7xZZlB2mwyzJ2sUKG6w","Post Malone","White Iverson","Universal Records",100,194,53,"3854794"
187,"spotify:track:3iq9nhbI8fcnNamxMft1uv","Camila Cabello","Real Friends","Syco Music/Epic",36,184,11,"3812972"
188,"spotify:track:3ebXMykcMXOcLeJ9xZ17XH","Martin Garrix, Dua Lipa","Scared to Be Lonely","Epic Amsterdam",5,-1,53,"3761245"
189,"spotify:track:76iVOVsliCHlWqKuDnCfhE","Zacari, Babes Wodumo","Redemption (with Babes Wodumo)","Black Panther (TDE/DMG) PS",153,153,2,"3759457"
190,"spotify:track:4KXwFI9pgJLpUIAc9oSL8j","Ab-Soul, Anderson .Paak, James Blake","Bloody Waters (with Anderson .Paak & James Blake)","Black Panther (TDE/DMG) PS",114,114,2,"3730355"
191,"spotify:track:0zl3PdjIl320fK0pxBGWNR","6ix9ine, Fetty Wap, A Boogie Wit da Hoodie","KEKE","Scumgang/TenThousand Projects",112,187,5,"3719624"
192,"spotify:track:2m2ZGfJcs3lHWNPzhWH3XH","Ozuna, Cardi B","La Modelo","VP Records Corp/Dimelo Vi",159,-1,7,"3704079"
193,"spotify:track:3uhBIQ7tv8j1FME8cFGEfG","John Legend","All of Me","G.O.O.D. Music/Columbia",147,173,11,"3686788"
194,"spotify:track:7F9vK8hNFMml4GtHsaXui6","Louis Tomlinson, Bebe Rexha, Digital Farm Animals","Back to You (feat. Bebe Rexha & Digital Farm Animals)","Syco Music",15,196,31,"3682667"
195,"spotify:track:7y9iMe8SOB6z3NoHE2OfXl","Halsey","Bad At Love","Astralwerks (ASW)",68,192,26,"3676068"
196,"spotify:track:7oK9VyNzrYvRFo7nQEYkWN","The Killers","Mr. Brightside","Island Records",148,-1,15,"3648780"
197,"spotify:track:5goGDc74vVREyN8al8CkPh","Drake","Diplomatic Immunity","Republic Records",19,169,5,"3645041"
198,"spotify:track:3ZhTT6yjZwpPph5MIJ53XY","Lil Skies, Landon Cube","Red Roses (feat. Landon Cube)","All We Got Ent.",198,-1,1,"3636000"
199,"spotify:track:2RttW7RAu5nOAfq6YFvApB","Ed Sheeran","Happier","Atlantic Records UK",10,-1,50,"3634742"
