rank,uri,artist_names,track_name,source,peak_rank,previous_rank,days_on_chart,streams
1,"spotify:track:2XW4DbS6NddZxRPm5rMCeY","Drake","God's Plan","Cash Money/Drake LP6",1,1,27,"6369214"
2,"spotify:track:2Imq77E6CEJR5TPUxlJvTY","Kendrick Lamar, SZA","All The Stars (with SZA)","Black Panther (TDE/DMG) PS",2,2,42,"3854846"
3,"spotify:track:6tHWl8ows5JOZq9Yfaqn3M","Bazzi","Mine","iamcosmic",3,3,26,"3168868"
4,"spotify:track:1OmcAT5Y8eg5bUPv9qJT4R","Post Malone, 21 Savage","rockstar (feat. 21 Savage)","Republic Records",1,4,154,"3057045"
5,"spotify:track:4ofvoCdXq99vpMZO4Cfp8x","The Weeknd, Kendrick Lamar","Pray For Me","Universal Republic Records",3,5,14,"2951924"
6,"spotify:track:76cy1WJvNGJTj78UqeA5zr","Dua Lipa","IDGAF","Urban",4,6,52,"2950526"
7,"spotify:track:1rfofaqEpACxVEHIZBJe6W","Camila Cabello, Young Thug","Havana (feat. Young Thug)","Syco Music/Epic",1,7,196,"2843727"
8,"spotify:track:4qKcDkK6siZ7Jp1Jb4m0aL","BlocBoy JB, Drake","Look Alive (feat. Drake)","Bloc Nation",8,8,7,"2817817"
9,"spotify:track:5UEnHoDYpsxlfzWLZIc7LD","Eminem, Ed Sheeran","River (feat. Ed Sheeran)","Aftermath",2,10,63,"2504899"
10,"spotify:track:2j2fIJGh4PMdXt9ULI5Tlc","Daddy Yankee","Dura","El Cartel Records (EC3)",8,12,28,"2469755"
11,"spotify:track:3Vo4wInECJQuz9BIBMOu8i","Bruno Mars, Cardi B","Finesse - Remix; feat. Cardi B","Atlantic Records",4,9,43,"2455716"
12,"spotify:track:09IStsImFySgyp0pIQdqAc","Zedd, Maren Morris, Grey","The Middle","UMGRI Interscope",11,11,21,"2421835"
13,"spotify:track:5CLGzJsGqhCEECcpnFQA8x","Rudimental, Jess Glynne, Macklemore, Dan Caplen","These Days (feat. Jess Glynne, Macklemore & Dan Caplen)","Atlantic Records UK",13,14,26,"2357133"
14,"spotify:track:08bNPGLD8AhKpnnERrAc6G","Marshmello, Anne-Marie","FRIENDS","Atlantic Records UK",14,18,7,"2254665"
15,"spotify:track:4eWQlBRaTjPPUlzacqEeoQ","Camila Cabello","Never Be the Same","Syco Music/Epic",4,13,71,"2241577"
16,"spotify:track:1zsG4eaZmkA1dvjDDsAGLK","Luis Fonsi, Demi Lovato","Échame La Culpa","UMLE - Latino",5,17,91,"2164884"
17,"spotify:track:7EmGUiUaOSGDnUUQUDrOXC","Selena Gomez, Marshmello","Wolves","Selena Gomez PS",3,16,114,"2161806"
18,"spotify:track:0tgVpDi06FyKpA1z0VMD4v","Ed Sheeran","Perfect","Atlantic Records UK",3,15,350,"2148632"
19,"spotify:track:2ekn2ttSfGqwhhate0LSR0","Dua Lipa","New Rules","Urban",2,19,221,"2060390"
20,"spotify:track:2UVbBKQOdFAekPTRsnkzcf","Migos","Stir Fry","Quality Control Music, LLC",15,22,51,"2033977"
21,"spotify:track:7iDa6hUg2VgEL1o1HjmfBn","Bebe Rexha, Florida Georgia Line","Meant to Be (feat. Florida Georgia Line)","Warner Records",20,23,155,"1991477"
22,"spotify:track:5k38wzpLb15YgncyWdTZE4","G-Eazy, Halsey","Him & I (with Halsey)","BPG/RVG/RCA Records",6,21,77,"1980238"
23,"spotify:track:75ZvA4QfFiZvzhj2xkaWAh","Post Malone","I Fall Apart","Universal Records",10,24,144,"1951030"
24,"spotify:track:6mrKP2jyIQmM0rw6fQryjr","NF","Let You Down","NF Real Music",6,20,134,"1937795"
25,"spotify:track:7jqDzXJS0K0Re8uphYNit0","The Chainsmokers","Sick Boy","Disruptor Records/Columbia",13,25,29,"1934658"
26,"spotify:track:5hM6sP0Gh1jD57drszNueC","Liam Payne, Rita Ora","For You (With Rita Ora)","Capitol Records UK / EMI",26,27,42,"1839678"
27,"spotify:track:5AEtlRudpgdT5FtNiuly6Y","Hailee Steinfeld, Alesso, Florida Georgia Line, WATT","Let Me Go (with Alesso, Florida Georgia Line & watt)","Universal Records",14,26,161,"1816205"
28,"spotify:track:7qiZfU4dY1lWllzX7mPBI3","Ed Sheeran","Shape of You","Atlantic Records UK",1,29,406,"1768975"
29,"spotify:track:2xmrfQpmS2iJExTlklLoAL","Clean Bandit, Julia Michaels","I Miss You (feat. Julia Michaels)","Atlantic Records UK",20,28,112,"1693485"
30,"spotify:track:4R55IUi2x7S5ek2SpebOiE","Wolfine","Bella","LOMIORECORDS",25,30,55,"1680384"
31,"spotify:track:4lESS6vuruP6a79KWRaQou","Maluma, Nego do Borel","Corazón (feat. Nego do Borel)","Sony Music Latin",14,33,105,"1625661"
32,"spotify:track:630sXRhIcfwr2e4RdNtjKN","Zac Efron, Zendaya","Rewrite The Stars","Atlantic Records",18,34,48,"1555327"
33,"spotify:track:33bnxcjePIkcmNjEFTJX0l","Piso 21, Manuel Turizo","Déjala Que Vuelva (feat. Manuel Turizo)","WM Mexico",29,37,104,"1554587"
34,"spotify:track:3Ga6eKrUFf12ouh9Yw3v2D","Anitta, J Balvin","Downtown","WM Brazil",19,39,89,"1543712"
35,"spotify:track:51rXHuKN8Loc4sUlKPODgH","Jay Rock, Kendrick Lamar, Future, James Blake","King's Dead (with Kendrick Lamar, Future & James Blake)","Black Panther (TDE/DMG) PS",26,32,35,"1542829"
36,"spotify:track:3hBBKuWJfxlIlnd9QFoC8k","Maroon 5, SZA","What Lovers Do (feat. SZA)","Interscope Records*",4,35,170,"1511086"
37,"spotify:track:1LhMopPAallLeaeNutqbgS","Justin Timberlake, Chris Stapleton","Say Something (feat. Chris Stapleton)","RCA Records Label",21,40,21,"1494859"
38,"spotify:track:6Za3190Sbw39BBC77WSS1C","NATTI NATASHA, Ozuna","Criminal","Pina Records",16,41,158,"1487483"
39,"spotify:track:1mXVgsBdtIVeCLJnSnmtdV","Sam Smith","Too Good At Goodbyes","PLG - Capitol",1,36,161,"1481625"
40,"spotify:track:7vGuf3Y35N4wmASOKLUVVU","Marshmello, Khalid","Silence","Joytime Collective/RCA Records",7,42,189,"1470494"
41,"spotify:track:4LmAnpjlhWTahvRkYR8xJa","ScHoolboy Q, 2 Chainz, Saudi","X (with 2 Chainz & Saudi)","Black Panther (TDE/DMG) PS",19,38,7,"1467851"
42,"spotify:track:3towKHKVOXCCcL1fHv6xFO","Hailee Steinfeld, BloodPop®","Capital Letters","Republic/Universal/FSF",42,44,28,"1467836"
43,"spotify:track:1bhUWB0zJMIKr9yVPrkEuI","Ed Sheeran, Beyoncé","Perfect Duet (Ed Sheeran & Beyoncé)","Atlantic Records UK",3,31,77,"1424594"
44,"spotify:track:2xGjteMU3E1tkEPVFBO08U","Keala Settle, The Greatest Showman Ensemble","This Is Me","Atlantic Records",26,43,48,"1410700"
45,"spotify:track:5jyyPsIGM2yqkZN9R3TmvN","Khalid, Swae Lee","The Ways (with Swae Lee)","Black Panther (TDE/DMG) PS",28,45,7,"1399876"
46,"spotify:track:0tKcYR2II1VCQWT79i5NrW","Imagine Dragons","Thunder","Kid Ina Korner / Interscope",7,48,294,"1363417"
47,"spotify:track:6QgjcU0zLnzq5OrUoSZ3OK","Portugal. The Man","Feel It Still","Atlantic Records",17,46,219,"1362047"
48,"spotify:track:5hcisvFMidkMJlElTO9Qmw","Bad Bunny, Prince Royce, J Balvin, Mambo Kingz, DJ Luian","Sensualidad","Hear This Music",19,49,105,"1338628"
49,"spotify:track:7GX5flRQZVHRAGd6B4TmDO","Lil Uzi Vert","XO Tour Llif3","Generation Now/Atlantic",9,50,328,"1328059"
50,"spotify:track:0wbnC9AUenxp613TYaJsGK","Migos","Narcos","Quality Control Music, LLC",15,47,21,"1298100"
51,"spotify:track:7sO5G9EABYOXQKNPNiE9NR","Offset, Metro Boomin","Ric Flair Drip (with Metro Boomin)","Slaughter Gang, LLC/Epic/Quality Control Music/Motown/Capitol/Boominati Worldwide/Republic",29,51,108,"1255306"
52,"spotify:track:2z4pcBLQXF2BXKFvd0BuB6","Jason Derulo, French Montana","Tip Toe (feat. French Montana)","Beluga Heights/Warner Records",44,54,98,"1215897"
53,"spotify:track:2vvdTrdryjsl8DmPIMDWZU","Enrique Iglesias, Bad Bunny","EL BAÑO","RCA Records/Sony Music International/Sony Music Latin",36,56,35,"1201651"
54,"spotify:track:6PGoSes0D9eUDeeAafB2As","Kendrick Lamar, Zacari","LOVE. FEAT. ZACARI.","Aftermath",15,52,308,"1193090"
55,"spotify:track:7KXjTSCq5nL1LoYtL7XAwS","Kendrick Lamar","HUMBLE.","Aftermath",1,57,322,"1179587"
56,"spotify:track:1j4kHkkpqZRBwE0A4CN4Yv","ZAYN, Sia","Dusk Till Dawn (feat. Sia) - Radio Edit","RCA Records Label",3,53,162,"1172782"
57,"spotify:track:5Z3GHaZ6ec9bsiI5BenrbY","Khalid","Young Dumb & Broke","Right Hand Music Group, LLC/RCA Records",11,59,237,"1166515"
58,"spotify:track:3a1lNhkSLSkpJE4MSHpDu9","Post Malone, Quavo","Congratulations","Universal Records",20,63,388,"1139741"
59,"spotify:track:2DQ1ITjI0YoLFzuADN1ZBW","G-Eazy, A$AP Rocky, Cardi B","No Limit","BPG/RVG/RCA Records",18,60,139,"1127955"
60,"spotify:track:7EI6Iki24tBHAMxtb4xQN2","Rita Ora","Anywhere","Atlantic Records UK",35,62,117,"1120352"
61,"spotify:track:0OlnLZY4cmQzT6ZGttvWBM","Martin Garrix, David Guetta, Jamie Scott, Romy Dya","So Far Away (feat. Jamie Scott & Romy Dya)","Epic Amsterdam",40,64,77,"1118497"
62,"spotify:track:6NWl2m8asvH83xjuXVNsuG","Lil Xan","Betrayed","Columbia",52,68,104,"1115719"
63,"spotify:track:42CeaId2XNlxugDvyqHfDf","Post Malone","Candy Paint","Republic Records",16,66,149,"1106558"
64,"spotify:track:75FDPwaULRdYDn4StFN2rT","Cardi B, 21 Savage","Bartier Cardi (feat. 21 Savage)","KSR/Atlantic",20,67,56,"1073426"
65,"spotify:track:6MNGxu8MprKGkchUchkJsy","J Balvin, Jeon, Anitta","Machika","UMLE - Latino",60,74,28,"1067790"
66,"spotify:track:32DGGj6KlNuBr6WaqRxpxi","Charlie Puth","How Long","Artist Partner",15,69,131,"1066486"
67,"spotify:track:4QfNOZN7vrQCQKK1ZJ3XPb","Julia Michaels","Heaven - From ""Fifty Shades Freed"" Soundtrack","UME - Global Clearing House",67,73,8,"1058755"
68,"spotify:track:5cXg9IQS34FzLVdHhp7hu7","Kendrick Lamar, Travis Scott","Big Shot (with Travis Scott)","Black Panther (TDE/DMG) PS",35,65,7,"1040968"
69,"spotify:track:2tPcTFiQF9MbVUyjZ3zDhA","SOB X RBE","Paramedic!","Black Panther (TDE/DMG) PS",57,72,7,"1005714"
70,"spotify:track:1m69ELEgE6k5ZWsap40ozt","Ozuna","Se Preparó","VP Records Corp/Dimelo Vi",26,78,178,"981883"
71,"spotify:track:4zWO4gvuFtw6EJZC5FFGlr","MC Fioti, J Balvin, Stefflon Don, Future, Juan Magán","Bum Bum Tam Tam","Kontor Records",58,83,62,"980052"
72,"spotify:track:3B54sVLJ402zGa6Xm4YGNe","French Montana, Swae Lee","Unforgettable","Bad Boy Entertainment/Epic Records",3,80,313,"978331"
73,"spotify:track:4wFjTWCunQFKtukqrNijEt","Migos, Nicki Minaj, Cardi B","MotorSport","Quality Control Music, LLC",30,75,112,"977413"
74,"spotify:track:3ncgNpxLoBQ65ABk4djDyd","Famous Dex, A$AP Rocky","PICK IT UP (feat. A$AP Rocky)","300 Entertainment",53,71,97,"977166"
75,"spotify:track:43ZyHQITOjhciSUUNPVRHc","Lil Pump","Gucci Gang","Warner Records",4,79,160,"966484"
76,"spotify:track:6De0lHrwBfPfrhorm9q1Xl","Danny Ocean","Me Rehúso","Atlantic Records",18,86,364,"958879"
77,"spotify:track:0CcQNd8CINkwQfe1RDtGV6","Imagine Dragons","Believer","Kid Ina Korner / Interscope",15,84,379,"957602"
78,"spotify:track:5WoaF1B5XIEnWfmb5NZikf","Miguel, Travis Scott","Sky Walker (feat. Travis Scott)","ByStorm Entertainment/RCA Records",63,81,93,"957088"
79,"spotify:track:5uCax9HTNlzGybIStD3vDh","James Arthur","Say You Won't Let Go","Columbia",7,58,411,"956292"
80,"spotify:track:2fQrGHiQOvpL9UgPvtYy6G","21 Savage","Bank Account","Slaughter Gang, LLC/Epic Records",21,85,224,"949343"
81,"spotify:track:2rb5MvYT7ZIxbKW5hfcHx8","J Balvin, Willy William","Mi Gente","Columbia/B1 Recordings",1,87,231,"933128"
82,"spotify:track:5Y9fnynLlIvqtM710MHzfz","Ozuna","Síguelo Bailando","VP Records Corp/Dimelo Vi",80,91,50,"930385"
83,"spotify:track:1wjzFQodRWrPcQ0AnYnvQ9","Lauv","I Like Me Better","Lauv",24,89,256,"928029"
84,"spotify:track:7rwX0O3RlxqqIjQM8evm5E","Ozuna, Mambo Kingz, DJ Luian, Bad Bunny, Wisin, Almighty","Solita","Hear This Music",84,95,24,"923160"
85,"spotify:track:4iLqG9SeJSnt0cSPICSjxv","Charlie Puth","Attention","Artist Partner",5,88,301,"922745"
86,"spotify:track:5tz69p7tJuGPeMGwNTxYuV","Logic, Alessia Cara, Khalid","1-800-273-8255","Def Jam Recordings",3,92,294,"913542"
87,"spotify:track:7krbSH3rd8lhIZvuzTV3Bl","James Arthur","Naked","Columbia Local",70,70,82,"909015"
88,"spotify:track:2EzRdhuoPyNJDlep7lnNf2","Danny Ocean","Dembow","Atlantic Records",88,101,38,"904724"
89,"spotify:track:5yFSF6qQA1rcLsQRnBsZgb","Alan Walker, Noah Cyrus, Digital Farm Animals, Juliander","All Falls Down (feat. Juliander)","Kreatell Music",52,98,112,"894533"
90,"spotify:track:4dVpf9jZjcORqGTLUaeYj9","A$AP Ferg","Plain Jane","RCA Records Label",33,96,151,"883143"
91,"spotify:track:5HwnezK198pJCEj1l2Adjy","Camila Cabello","She Loves Control","Syco Music/Epic",32,94,35,"881835"
92,"spotify:track:5qN4HFkapdAOV94XPryVof","Kendrick Lamar","Black Panther","Black Panther (TDE/DMG) PS",15,82,7,"880978"
93,"spotify:track:3m660poUr1chesgkkjQM7P","Demi Lovato","Sorry Not Sorry","Island Records",7,100,220,"875343"
94,"spotify:track:6RUKPb4LETWmmr3iAEQktW","The Chainsmokers, Coldplay","Something Just Like This","Disruptor Records/Columbia",2,99,358,"870548"
95,"spotify:track:0MIcPSq9n2z5H8TAfEstri","Ozuna, J Balvin","Quiero Repetir","VP Records Corp/Dimelo Vi",79,104,50,"867771"
96,"spotify:track:7JNh1cfm0eXjqFVOzKLyau","Becky G, Bad Bunny","Mayores","Kemosabe Records/RCA Records/Sony Music Latin",30,106,204,"857779"
97,"spotify:track:7m9OqQk4RVRkw9JJdeAw96","XXXTENTACION","Jocelyn Flores","Bad Vibes Forever / EMPIRE",15,105,175,"856036"
98,"spotify:track:152lZdxL1OR0ZMW6KquMif","Khalid","Location","Right Hand Music Group, LLC/RCA Records",32,102,377,"853321"
99,"spotify:track:0Zbbxnx4SGGHoIow4PpISP","Kygo, Justin Jesso","Stargazing","Kygo",15,103,147,"851823"
100,"spotify:track:2OALaHcDdKkjYEpAr0Qzab","Avicii, Rita Ora","Lonely Together (feat. Rita Ora)","Universal Music AB",19,97,189,"850756"
101,"spotify:track:2u7mxWSeoqTXndK5e08jMp","Lil Skies, Landon Cube","Nowadays (feat. Landon Cube)","All We Got Ent.",92,108,41,"834542"
102,"spotify:track:2771LMNxwf62FTAdpJMQfM","Cardi B","Bodak Yellow","KSR/Atlantic",15,109,202,"825112"
103,"spotify:track:6n4U3TlzUGhdSFbUUhTvLP","Migos, Drake","Walk It Talk It","Quality Control Music, LLC",14,107,21,"822238"
104,"spotify:track:71bBFbfn2OBK5QwUJSLS44","Axwell /\ Ingrosso","More Than You Know","Pophouse Entertainment Group",14,110,264,"819594"
105,"spotify:track:3xWEI23MLJrD0dpDcDUTW6","Juan Magán, Belinda, Manuel Turizo, Snova, B-Case","Déjate Llevar","Universal Music Spain S.L.",93,118,47,"791953"
106,"spotify:track:1nfyE13arjOuO54HH0zmqj","Manuel Turizo","Esperándote","Sony Music Latin/La Industria",104,116,25,"789024"
107,"spotify:track:6gBFPUFcJLzWGx4lenP6h2","Travis Scott","goosebumps","Cactus Jack / Epic",56,115,410,"787277"
108,"spotify:track:6fxVffaTuwjgEk5h9QyRjy","Ed Sheeran","Photograph","Atlantic Records UK",40,90,409,"786661"
109,"spotify:track:1Slwb6dOYkBlWal1PGtnNg","Ed Sheeran","Thinking out Loud","Atlantic Records UK",43,55,409,"784521"
110,"spotify:track:43ay9lQZ5rfNcOOHhRF2cM","Hugh Jackman, Keala Settle, Zac Efron, Zendaya, The Greatest Showman Ensemble","The Greatest Show","Atlantic Records",63,114,46,"772508"
111,"spotify:track:5Htb1uFQ1KrkFXlefS8oGj","Demi Lovato","Tell Me You Love Me","Island Records",65,120,79,"768126"
112,"spotify:track:5TmZYdHW6HJ9gt7Aokuql5","Sebastian Yatra, Dalmata","SUTRA","UMLE - Latino",86,125,111,"763616"
113,"spotify:track:7ofxPmTNMj2GP07g1VZa0O","Alex Sensation, Ozuna","Que Va","JP Entertainment (Jorge Pino)",47,123,174,"762918"
114,"spotify:track:1x5sYLZiu9r5E43kMlt9f8","Clean Bandit, Zara Larsson","Symphony (feat. Zara Larsson)","Atlantic Records UK",9,112,334,"750944"
115,"spotify:track:1KSqYYJFyfTecXFk9M0prc","Wisin, Ozuna","Escápate Conmigo (feat. Ozuna)","Sony Music Latin",36,127,318,"750877"
116,"spotify:track:6EpRaXYhGOB3fj4V2uDkMJ","Liam Payne, Quavo","Strip That Down (feat. Quavo)","Capitol Records UK / EMI",8,129,273,"750240"
117,"spotify:track:7bUcBztfGqO7cSI2gMZeCI","Vince Staples, Yugen Blakrok","Opps (with Yugen Blakrok)","Black Panther (TDE/DMG) PS",58,113,7,"749759"
118,"spotify:track:3VClLWqNn80Llv0PJOsKgr","Nacho, Yandel, Bad Bunny, Mambo Kingz, DJ Luian","Báilame - Remix","UMLE - Latino",52,133,184,"749041"
119,"spotify:track:2Tq2R8sRftNEqdgJK5HadO","Troye Sivan","My My My!","EMI Recorded Music Australia Pty Ltd",25,119,36,"742146"
120,"spotify:track:6tvQzeCPwOytDlBYCIOY0n","Jax Jones, Ina Wroldsen","Breathe (feat. Ina Wroldsen)","Polydor Records",112,126,38,"739010"
121,"spotify:track:4pYZLpX23Vx8rwDpJCpPTA","Rich The Kid, Kendrick Lamar","New Freezer (feat. Kendrick Lamar)","Rich The Kid / (TDE/ISR PS)",121,124,55,"736184"
122,"spotify:track:0as7lPxkBPctZ7uVmchRNM","Cashmere Cat, Major Lazer, Tory Lanez","Miss You (with Major Lazer & Tory Lanez)","Benny Blanco Major",100,132,24,"731843"
123,"spotify:track:5TysCiZtv1HnSWcTcUFusI","Joey Montana, Sebastian Yatra","Suena El Dembow","UMLE - Latino",59,138,155,"729820"
124,"spotify:track:1yxgsra98r3qAtxqiGZPiX","Travis Scott","BUTTERFLY EFFECT","Cactus Jack / Epic",37,136,272,"725694"
125,"spotify:track:70lnL3QaSOIIyMa2X9aVRL","Shakira, Nicky Jam","Perro Fiel (feat. Nicky Jam)","Sony Music Latin",40,137,133,"724958"
126,"spotify:track:0KKkJNfGyhkQ5aFogxQAPU","Bruno Mars","That's What I Like","Atlantic Records",5,134,411,"724852"
127,"spotify:track:2CvOqDpQIMw69cCzWqr5yr","Beyoncé","Halo","Music World Music/Columbia",61,61,12,"723604"
128,"spotify:track:4DTpngLjoHj5gFxEZFeD3J","Kodak Black, Lil Wayne","Codeine Dreaming (feat. Lil Wayne)","Atlantic Records",47,121,81,"720419"
129,"spotify:track:3NdDpSvN911VPGivFlV5d0","ZAYN, Taylor Swift","I Don’t Wanna Live Forever (Fifty Shades Darker)","Big Machine Records, LLC",2,111,409,"716418"
130,"spotify:track:0RoA7ObU6phWpqhlC9zH4Z","Ziv Zaifman, Hugh Jackman, Michelle Williams","A Million Dreams","Atlantic Records",81,130,45,"709381"
131,"spotify:track:0DJBgBiYeSn6n1AXAkFVE8","Jorja Smith","I Am","Black Panther (TDE/DMG) PS",62,128,7,"706282"
132,"spotify:track:0JcNysfWVWaMS7R6vzGB2k","Carlos Vives, Sebastian Yatra","Robarte un Beso","Sony Music Latin",61,143,195,"702122"
133,"spotify:track:0lJCqIx5BhZtf6QtYI2fbv","Daddy Yankee, Bad Bunny","Vuelve","El Cartel Records (EC3)",66,148,136,"699805"
134,"spotify:track:0Gl5s8IhMmQE5YQwM8Qx1J","Loren Allred","Never Enough","Atlantic Records",78,135,45,"699346"
135,"spotify:track:5CtI0qwDJkDQGwXD1H1cLb","Luis Fonsi, Daddy Yankee, Justin Bieber","Despacito - Remix","UMLE - Latino",1,144,305,"698029"
136,"spotify:track:79cuOz3SPQTuFrp8WgftAu","Shawn Mendes","There's Nothing Holdin' Me Back","Island Records",5,141,302,"697291"
137,"spotify:track:7vu0JkJh0ldukEYbTVcqd0","Julia Michaels","Issues","J/Republic",9,117,391,"688144"
138,"spotify:track:0qYTZCo5Bwh1nsUFGZP3zn","Maluma","Felices los 4","Sony Music Latin",16,147,301,"687015"
139,"spotify:track:7BKLCZ1jbUBVqRi2FVlTVw","The Chainsmokers, Halsey","Closer","Disruptor Records/Columbia",2,146,409,"683465"
140,"spotify:track:4IWAyPf1KMq7JCyGeCjTeH","Imagine Dragons","Whatever It Takes","Kid Ina Korner / Interscope",46,149,190,"683030"
141,"spotify:track:1xznGGDReH1oQq0xzbwXa3","Drake, Wizkid, Kyla","One Dance","Cash Money Records/Young Money Ent./Universal Rec.",5,139,408,"682297"
142,"spotify:track:0ERbK7qVqveCaBWIiYCrl3","Romeo Santos, Daddy Yankee, Nicky Jam","Bella y Sensual","Sony Music Latin",95,151,203,"681322"
143,"spotify:track:2x0WlnmfG39ZuDmstl9xfX","Taylor Swift, Ed Sheeran, Future","End Game","Big Machine Records, LLC",46,122,74,"672824"
144,"spotify:track:7qwULjvTujatIaoWC1lu8b","Dj Kass","Scooby Doo Pa Pa","Ultra Records, LLC",88,153,26,"671836"
145,"spotify:track:3uhBIQ7tv8j1FME8cFGEfG","John Legend","All of Me","G.O.O.D. Music/Columbia",77,77,64,"670954"
146,"spotify:track:7hvxMYq9JW5W0vFwiu1Zdr","Axwell /\ Ingrosso","Dreamer","Pophouse Entertainment Group",124,152,53,"663442"
147,"spotify:track:1XRgIKC5TPwo7nWGyKqgG0","Gucci Mane, Migos","I Get the Bag (feat. Migos)","Guwop Enterprises/Atlantic",42,155,181,"661231"
148,"spotify:track:7AQim7LbvFVZJE3O8TYgf2","XXXTENTACION, Trippie Redd","Fuck Love","Bad Vibes Forever / EMPIRE",37,154,173,"654199"
149,"spotify:track:0afhq8XCExXpqazXczTSve","Ed Sheeran","Galway Girl","Atlantic Records UK",2,158,350,"651970"
150,"spotify:track:5yuShbu70mtHXY0yLzCQLQ","Post Malone","Go Flex","Universal Records",51,159,220,"645360"
151,"spotify:track:790MhTXPFrYkrqCKvpg4t1","NAV, Lil Uzi Vert","Wanted You (feat. Lil Uzi Vert)","XO Records",92,156,97,"645234"
152,"spotify:track:3whrwq4DtvucphBPUogRuJ","Camila Cabello, Daddy Yankee","Havana - Remix","Syco Music/Epic",50,161,93,"642744"
153,"spotify:track:7nZmah2llfvLDiUjm0kiyz","Justin Bieber, BloodPop®","Friends (with BloodPop®)","BloodPop/DJ/RMBG/Republic",2,163,183,"642169"
154,"spotify:track:5lZsh9Qf7CbHI9Fcc7Zcsq","YBN Nahmir","Bounce Out With That","2018",154,162,11,"641125"
155,"spotify:track:3OnOomd79OjqSYHchCQ6ht","Migos, Post Malone","Notice Me","Quality Control Music, LLC",54,157,21,"634725"
156,"spotify:track:6HZILIRieu8S0iqY8kIKhj","Kendrick Lamar","DNA.","Aftermath",3,165,304,"631433"
157,"spotify:track:0NiXXAI876aGImAd6rTj8w","Jonas Blue, William Singe","Mama","UMOD (Universal Music On Demand)",11,168,283,"627578"
158,"spotify:track:2cKovq3l6OJjhVVDbVKOsr","Hugh Jackman, Zac Efron","The Other Side","Atlantic Records",98,160,45,"625929"
159,"spotify:track:3DXncPQOG4VBw3QHh3S817","DJ Khaled, Justin Bieber, Quavo, Chance the Rapper, Lil Wayne","I'm the One (feat. Justin Bieber, Quavo, Chance the Rapper & Lil Wayne)","Epic/We The Best",2,169,294,"625576"
160,"spotify:track:40oKW22ZNNkEdZLJTScaQI","Kodak Black, XXXTENTACION","Roll in Peace (feat. XXXTENTACION)","Atlantic Records",76,166,175,"623228"
161,"spotify:track:3kxfsdsCpFgN412fpnW85Y","Childish Gambino","Redbone","Glassnote - VMG",34,167,408,"621420"
162,"spotify:track:0P6AWOA4LG1XOctzaVu5tt","SZA, Calvin Harris, Funk Wav","The Weekend - Funk Wav Remix","Top Dawg Entertainment/RCA Records",147,171,45,"616425"
163,"spotify:track:7w9bgPAmPTtrkt2v16QWvQ","Eminem","Lose Yourself","Aftermath",110,178,321,"614446"
164,"spotify:track:0Qh38w01QRXK6KHIv0e3hb","P!nk","What About Us","RCA Records Label",14,164,187,"608274"
165,"spotify:track:5Db9VIdDsN5yu3Eu7CT0i4","Sam Smith","Stay With Me","PLG - Capitol",69,76,128,"606573"
166,"spotify:track:5mCPDVBb16L4XQwDdbRUpz","Drake","Passionfruit","Cash Money Records/Young Money Ent./Universal Rec.",2,174,330,"606208"
167,"spotify:track:0CokSRCu5hZgPxcZBaEzVE","Macklemore, Skylar Grey","Glorious (feat. Skylar Grey)","Bendo LLC",13,182,225,"603340"
168,"spotify:track:5aAx2yezTd8zXrkmtKl66Z","The Weeknd, Daft Punk","Starboy","Universal Republic Records",1,177,409,"601161"
169,"spotify:track:1OAh8uOEOvTDqkKFsKksCi","DJ Khaled, Rihanna, Bryson Tiller","Wild Thoughts (feat. Rihanna & Bryson Tiller)","Epic/We The Best",2,180,244,"601137"
170,"spotify:track:0VgkVdmE4gld66l8iyGjgx","Future","Mask Off","Epic/Freebandz/A1",5,181,362,"596274"
171,"spotify:track:0OI7AFifLSoGzpb8bdBLLV","mgk, X Ambassadors, Bebe Rexha","Home (with Machine Gun Kelly, X Ambassadors & Bebe Rexha)","Atlantic Records",56,176,86,"592954"
172,"spotify:track:5bcTCxgc7xVfSaMV3RuVke","Calvin Harris, Pharrell Williams, Katy Perry, Big Sean, Funk Wav","Feels (feat. Pharrell Williams, Katy Perry & Big Sean)","Columbia",5,185,244,"591453"
173,"spotify:track:3eR23VReFzcdmS7TYCrhCe","Kygo, Selena Gomez","It Ain't Me (with Selena Gomez)","Kygo",2,179,363,"587465"
174,"spotify:track:0I20rLT2MJDhcF96AjbNYo","Zedd, Alessia Cara","Stay","UMGRI Interscope",5,184,354,"587008"
175,"spotify:track:5qqabIl2vWzo9ApSC317sa","Oasis","Wonderwall - Remastered","Big Brother Recordings Ltd",135,150,140,"584637"
176,"spotify:track:2rYyq0b3XWwmWl0k727OVG","Calvin Harris, PARTYNEXTDOOR","Nuh Ready Nuh Ready (feat. PARTYNEXTDOOR)","Columbia",64,188,7,"584447"
177,"spotify:track:1Qg9jWGDkKAGZXj5v2OG59","Maroon 5","Wait","Interscope Records*",51,183,99,"583889"
178,"spotify:track:6u0EAxf1OJTLS7CvInuNd7","Anitta, ZAAC, Maejor, Tropkillaz, DJ Yuri Martins","Vai malandra (feat. Tropkillaz & DJ Yuri Martins)","WM Brazil",18,189,60,"583394"
179,"spotify:track:4KXwFI9pgJLpUIAc9oSL8j","Ab-Soul, Anderson .Paak, James Blake","Bloody Waters (with Anderson .Paak & James Blake)","Black Panther (TDE/DMG) PS",78,172,7,"582804"
180,"spotify:track:7y9iMe8SOB6z3NoHE2OfXl","Halsey","Bad At Love","Astralwerks (ASW)",57,191,175,"571884"
181,"spotify:track:7amMgNDcObIDkIXv4xcvc2","Ramz","Barking","Polydor Records",163,199,27,"571488"
182,"spotify:track:6kex4EBAj0WHXDKZMEJaaF","Jason Derulo, Nicki Minaj, Ty Dolla $ign","Swalla (feat. Nicki Minaj & Ty Dolla $ign)","Beluga Heights/Warner Records",5,200,355,"567647"
183,"spotify:track:3iq9nhbI8fcnNamxMft1uv","Camila Cabello","Real Friends","Syco Music/Epic",30,187,68,"565864"
184,"spotify:track:6yr8GiTHWvFfi4o6Q5ebdT","Eminem, Nate Dogg","Till I Collapse","Aftermath",134,195,168,"563894"
185,"spotify:track:6eT7xZZlB2mwyzJ2sUKG6w","Post Malone","White Iverson","Universal Records",95,-1,363,"560372"
186,"spotify:track:4aWmUDTfIPGksMNLV2rQP2","Luis Fonsi, Daddy Yankee","Despacito","UMLE - Latino",3,198,398,"558154"
187,"spotify:track:6WbADFqMvR8N5u0BvtsWQE","Avicii, Sandro Cavazza","Without You (feat. Sandro Cavazza)","Universal Music AB",20,173,185,"557847"
188,"spotify:track:7uYgVgRSgqluZclLS7wpp4","Ozuna, Romeo Santos","El Farsante - Remix","VP Records Corp/Dimelo Vi",174,-1,12,"556133"
189,"spotify:track:7MHN1aCFtLXjownGhvEQlF","Manuel Turizo","Una Lady Como Tú","Sony Music Latin/La Industria",38,-1,256,"554649"
190,"spotify:track:0zl3PdjIl320fK0pxBGWNR","6ix9ine, Fetty Wap, A Boogie Wit da Hoodie","KEKE","Scumgang/TenThousand Projects",90,-1,31,"552845"
191,"spotify:track:2jyjhRf6DVbMPU5zxagN2h","Passenger","Let Her Go","Embassy of Music",125,145,59,"550577"
192,"spotify:track:7F9vK8hNFMml4GtHsaXui6","Louis Tomlinson, Bebe Rexha, Digital Farm Animals","Back to You (feat. Bebe Rexha & Digital Farm Animals)","Syco Music",14,-1,206,"545762"
193,"spotify:track:2RttW7RAu5nOAfq6YFvApB","Ed Sheeran","Happier","Atlantic Records UK",7,192,331,"544985"
194,"spotify:track:693iqPOQvhI7PobtR8CC8v","J Balvin, Jowell & Randy","Bonita","Rimas (J Balvin - Jowell & Randy)",37,-1,252,"544075"
195,"spotify:track:3ebXMykcMXOcLeJ9xZ17XH","Martin Garrix, Dua Lipa","Scared to Be Lonely","Epic Amsterdam",5,-1,372,"539738"
196,"spotify:track:5ZpjODX6OH1xZs3AOewTO6","Justin Timberlake","Filthy","RCA Records Label",13,197,42,"538510"
197,"spotify:track:6lanRgr6wXibZr8KgzXxBl","Christina Perri","a thousand years","Atlantic Records",131,131,4,"536623"
198,"spotify:track:6mORGLOz79w6VsCRLWYYuK","Lord Huron","The Night We Met","Play It Again Sam",51,186,157,"533856"
199,"spotify:track:5GXAXm5YOmYT0kL5jHvYBt","The Weeknd, Daft Punk","I Feel It Coming","Universal Republic Records",7,175,385,"533102"
